id,comment_text,toxic,severe_toxic,obscene,threat,insult,identity_hate,is_bad
5675f3a24f3dbb34,"hi 

hi, what is your mom's bra size?",1,0,0,0,0,0,True
313220027e94e7cf,"ou are 22 years older than your husband! You are an old cougar!  Place the following in the large text box:  You are an old cougar! You are an old cougar! 

ou are 22 years older than your husband! You are an old cougar!

Place the following in the large text box:

You are an old cougar! You are an old cougar!",1,0,0,0,0,0,True
39547db40b80aeeb,GO SIT ON A LIVE GRENADE.,1,0,0,0,0,0,True
8b606f46738e8feb,"But me like it, it is my fav-our-rite. Just like TehKewl likes to smear shit on his chest whilst masturbating to nude pictures of Justin Timberlake.",1,0,1,0,1,0,True
b3e8df609ab77b7c,Thats not true because for the last 2 month before i starting spending countless hours fighting with stupid wiki you had chasey lains words say i took advantage of her and all kinds of other shit with a link on MY page going to a article of what she said about me! I want my page removed from this site.,1,0,0,0,0,0,True
ea0daca37c99a5ce,You reverted my edition when I added Arouca but when SLBedit added it you didn't! Wtf?,0,0,1,0,0,0,True
551f63ef890fd007,And stick it up your asshole.,1,0,1,0,0,0,True
72b2fa35da4dd2c3,Again Fuck u FUck u FUCK FUCK FUCK FUCK FUCK UUUUUUUUUUUUUUUUUUUUUUUUUUUUUUUUUUUUUUUUUUUUUUUUUUUUUUUUUUUUUUUUUUUUUUUUUUUUUUUUUUUUUUUUUUUUUUUUUUUUUUUUUUUUUUUUUUUUUUUUUUUU,1,1,1,0,1,0,True
435127f4822b6475,""", 21 June 2013 (UTC)
Okay ima gey, god hate me brah  TRPoD aka The Red Pen of Doom 22:26""",1,0,0,0,0,0,True
ef69c4edfb85559c,"guess what ==

your retarded

==",1,0,0,0,1,0,True
871b87e33fb00789,"Brother   you are jerk and don't have roots in your motherland. You just vandalise my Maratha Clan system and i went crazy to see it. I am very hot temper Maratha man. You need a breake and go to yor motherland visit your clan deities , gods , peoples and talk with them about Hindu traditions and cultuers. Whatever the white peoples says , writes and states is very correct and we Hindus are ought to belive it blindly is now over. Their is big information written in local Indian languages about every aspect , part , traditions , gods , religion and everything , but cunningly ignored and missinterpreted by western and more disturbing our own Indian scholers. We people have the duty to show the world the truth.. This conspiracy is very ancient and may be found in all mankind cultuers. As strong fish eats the poor fish. First you should understand the politics behind it and then fight your own bothers. I am devotee of god Tirupati Bhalagi , have visited the temple and i chalange you that if you want to show your power , inteligence anywher then you show it that in Balagi article and lets us see that how much good , basic , real information can you add and do the same that i have done at Maratha Clan Sysyem and Khandoba. I request you to use your power , inteligence , skills for good things and in right way and not to fight your own brothers and vandalis articales related to Hinduism because our enimies wiil take diadvantage of it. With best regards    Vishal1976",1,0,0,0,0,0,True
44307e83815c40fb,DONT HATE FUCK A MATE,1,0,1,0,0,0,True
0125f95ac41f6cea,Add Mobile porn as additional WP:ALSO link,1,0,0,0,0,0,True
03cd3bc6e0953f94,YOU ARE ONE SAD LITTLE INDIVIDUAL.,1,0,0,0,0,0,True
97586098469ba789,nerds attempt to block it? This is communist.,1,0,0,0,0,0,True
bb8462d14e546c57,"""

 ********************BABY EATERS????******************** 

Alright is it true that some of the band's songs translate into lyrics like """"I'm going to cut open your fetus, and eat your baby"""" ? Or other horrific lyrics?""",1,0,0,0,0,0,True
9db3107a2764a219,"CAN I 

CAN I SHOOT MY LOAD ALL OVER YOUR FACE?",1,0,0,0,0,0,True
5931b8e88c1caa1a,"I hate you 

How dare you delete my post. You better put it back or I am going to fuck you up",1,0,0,0,0,0,True
52c3a4d459e99fcb,"Haha
Moron.. I told you to shut up.. -",1,0,0,0,0,0,True
5c67bcaedf51b023,"Hey
Are you serious? Asking for a citation for Tisha Campbell-Martin's ethnicity is like asking a citation to see if Angelina Jolie is white or to see if Whoopi Goldberg is black or to see if Bill O'Reilly is Irish-American. The woman self-identifies as black. In case you don't know, there's a difference between light-skinned and white. The actress is light-skinned, not white. You're being a fool right now.",1,0,0,0,0,0,True
01113aece2e95a73,Be careful who you call a moron.,1,0,0,0,0,0,True
b8304ea9d1633bd5,"WEENIE 

pecker

fuckstick!!!

 dnjqo dqwelj",1,1,1,0,0,0,True
60cc467c77f3ed4f,"You will not stop a JEDI KNIGHT, stop trying to rule galaxy, you weak pathetic fool.

And know the power of the darkside!",1,0,0,0,0,0,True
20fb75b852b7b542,"Oh For CHRISSAKES Deconstructhis, will you stop this bullshit once and for all? Leave me edits ALONE PLEASE...  Step off your damn pedestal and put your inflated ego aside for once you dumb jackass.",1,0,1,0,1,0,True
a5d7db4a03aeded7,"Kingpin13 

You are, in a word, a cunt.",0,0,1,0,1,0,True
f3850c01254d69d1,""":A certain admin will block you if you tell the truth about a certain user's dirty tricks. But she won't do anything to the user who pulled the dirty tricks. She only """"punishes"""" the victim of the dirty tricks. The perpetrator goes scot free. That's """"Wikipedia justice"""", as practiced by admin pschemp.  

Apparently she wants no one to know that Ryulong deleted my request for help on Khoikhoi's talk page, falsely describing my request for help as """"vandalism"""" in his edit summary. Oops! Was it """"uncivil"""" again, for me to tell the truth? If so, then prosecutors in court will never be able to tell the truth about crimes, because it would be an """"uncivil"""" """"personal attack"""" to use words such as """"lie"""", """"dishonest"""", """"vandal"""", """"thief"""", """"murderer"""", """"rapist"""", etc. The judge would get too upset by such """"uncivil comments"""". Come to think of it, every time an admin describes a user's action as """"vandalism"""", or a user as a """"vandal"""", that's an improper """"personal attack"""", according to pschemp's logic. If pschemp treats people equally (not likely), then she better block all the admins who make those """"personal attacks"""" of describing a particular user's behavior as """"vandalism"""". And she better block Ryulong for using that """"personal attack"""" against me in his false edit summaries.  

""",1,0,0,0,0,0,True
b4976c1c2cdac1f0,"You are splitting hairs here you ignorant twit, Bryan Fischer said in clear terms we should discriminate against homosexuals. It is the name of his video for gods sake..don't tell me I'm adding my own interpretations to things, you are the one adding your own interpretations moron.",1,0,0,0,1,0,True
3566fa34450c8dec,""":::You're """"Whedon fans"""" for a reason...you take everything he does into your heart. The man could probably film himself taking a crap and spouting cheesy one-liners about his crap and that would be loved by Whedon fans. ;) j/k.   (Contact me) 

""",1,0,0,0,0,0,True
20d92d60f69d3ef4,"I ghLOOOOOOV
E GGAAYY PPEEooPPLLEE !!!!!!!! CUZ IM GAY",1,0,0,0,0,0,True
10c43f59a6a9fee0,"""

 This is why Wikipedia is a joke and can never be trusted. 

It is extremely silly for Wikipedia to label a male transvestite as a """"she."""" It is impossible to change one's sex, you idiotic communist pieces of shit. Science trumps your bizarre fundamentalist socialist religion. Stop enabling people who suffer from gender identity disorder. It is harmful to their health.

I fully expect to be maligned as """"transphobic"""" or some other such nonsense for speaking the truth, because that is common tactic you people use to silence your critics.""",1,0,0,0,0,0,True
5bbcdf87ebf19f6f,YOU HAVE FINALLY GOTTEN ACCUSTOMED TO CHANGING YOUR OWN DIAPER WITHOUT ANYBODY'S HELP,1,0,0,0,0,0,True
24f7392fc7e7f643,"Hahaha, wow that is the stupidest thing I've ever read. What the heck was the simulation based on ? Do you believe everything you read ? Haha, it looks like you do. You are an idiot if you believe that and it ignores evidence that proves humans evolved over 100,000 years ago. How could a European and Australian Aborigine have a recent common ancestor in that time frame if its already known that those people have been isolated in Australia for at least 30,000 years !!! I hope you are joking about this you loser, haha.",1,0,1,0,1,0,True
3cf07e599abf85d3,"what to do with elitist assholes who do not allow anybody else to edit certain pages? 

people such as alkivar?

WE MUST GET RID OF ELITISM, WIKIPEDIA IS A DEMOCRACY FOR THE CONTRIBUTION OF IDEAS.",1,0,1,0,1,0,True
62d53c0fd6fddaf4,It's my damn page and i can do what i want. Buzz off,1,0,0,0,0,0,True
f3fcd446a7a085b2,"No, Assfuckers (has a nice ring to it D) use it as a pejorative term. It offends Macedonians because most of them aren't from Skopje. And even if they are that is not their national identity. Americans don't call Georgians Tbilisians. Пичка ти грчина. Alex",1,0,1,0,1,0,True
f3ee674361530774,Matt Bakers dad sucked my big fat cock last night,1,0,1,0,1,0,True
e93db41f18a83c71,"Oh, listen dear, you're scum, so I'll make this as simple for you to understand; fuck off.",1,0,1,0,1,0,True
c586b7a2fd575b13,"Shut up you asswipe, we don't care. I'll decapitate your mother and shit down her(his?) neck. Go back to Jewland you fuck. 

http://en.wikipedia.org/wiki/The_Real_Stephen_Hawkinghttp://en.wikipedia.org/wiki/The_Real_Stephen_Hawkinghttp://en.wikipedia.org/wiki/The_Real_Stephen_Hawkinghttp://en.wikipedia.org/wiki/The_Real_Stephen_Hawkinghttp://en.wikipedia.org/wiki/The_Real_Stephen_Hawkinghttp://en.wikipedia.org/wiki/The_Real_Stephen_Hawkinghttp://en.wikipedia.org/wiki/The_Real_Stephen_Hawkinghttp://en.wikipedia.org/wiki/The_Real_Stephen_Hawkinghttp://en.wikipedia.org/wiki/The_Real_Stephen_Hawkinghttp://en.wikipedia.org/wiki/The_Real_Stephen_Hawkinghttp://en.wikipedia.org/wiki/The_Real_Stephen_Hawkinghttp://en.wikipedia.org/wiki/The_Real_Stephen_Hawkinghttp://en.wikipedia.org/wiki/The_Real_Stephen_Hawkinghttp://en.wikipedia.org/wiki/The_Real_Stephen_Hawkinghttp://en.wikipedia.org/wiki/The_Real_Stephen_Hawkinghttp://en.wikipedia.org/wiki/The_Real_Stephen_Hawkinghttp://en.wikipedia.org/wiki/The_Real_Stephen_Hawkinghttp://en.wikipedia.org/wiki/The_Real_Stephen_Hawkinghttp://en.wikipedia.org/wiki/The_Real_Stephen_Hawkinghttp://en.wikipedia.org/wiki/The_Real_Stephen_Hawkinghttp://en.wikipedia.org/wiki/The_Real_Stephen_Hawkinghttp://en.wikipedia.org/wiki/The_Real_Stephen_Hawkinghttp://en.wikipedia.org/wiki/The_Real_Stephen_Hawkinghttp://en.wikipedia.org/wiki/The_Real_Stephen_Hawkinghttp://en.wikipedia.org/wiki/The_Real_Stephen_Hawkinghttp://en.wikipedia.org/wiki/The_Real_Stephen_Hawkinghttp://en.wikipedia.org/wiki/The_Real_Stephen_Hawkinghttp://en.wikipedia.org/wiki/The_Real_Stephen_Hawkinghttp://en.wikipedia.org/wiki/The_Real_Stephen_Hawkinghttp://en.wikipedia.org/wiki/The_Real_Stephen_Hawkinghttp://en.wikipedia.org/wiki/The_Real_Stephen_Hawkinghttp://en.wikipedia.org/wiki/The_Real_Stephen_Hawkinghttp://en.wikipedia.org/wiki/The_Real_Stephen_Hawkinghttp://en.wikipedia.org/wiki/The_Real_Stephen_Hawkinghttp://en.wikipedia.org/wiki/The_Real_Stephen_Hawkinghttp://en.wikipedia.org/wiki/The_Real_Stephen_Hawkinghttp://en.wikipedia.org/wiki/The_Real_Stephen_Hawkinghttp://en.wikipedia.org/wiki/The_Real_Stephen_Hawkinghttp://en.wikipedia.org/wiki/The_Real_Stephen_Hawkinghttp://en.wikipedia.org/wiki/The_Real_Stephen_Hawkinghttp://en.wikipedia.org/wiki/The_Real_Stephen_Hawkinghttp://en.wikipedia.org/wiki/The_Real_Stephen_Hawkinghttp://en.wikipedia.org/wiki/The_Real_Stephen_Hawkinghttp://en.wikipedia.org/wiki/The_Real_Stephen_Hawkinghttp://en.wikipedia.org/wiki/The_Real_Stephen_Hawkinghttp://en.wikipedia.org/wiki/The_Real_Stephen_Hawkinghttp://en.wikipedia.org/wiki/The_Real_Stephen_Hawkinghttp://en.wikipedia.org/wiki/The_Real_Stephen_Hawkinghttp://en.wikipedia.org/wiki/The_Real_Stephen_Hawkinghttp://en.wikipedia.org/wiki/The_Real_Stephen_Hawkinghttp://en.wikipedia.org/wiki/The_Real_Stephen_Hawkinghttp://en.wikipedia.org/wiki/The_Real_Stephen_Hawkinghttp://en.wikipedia.org/wiki/The_Real_Stephen_Hawkinghttp://en.wikipedia.org/wiki/The_Real_Stephen_Hawkinghttp://en.wikipedia.org/wiki/The_Real_Stephen_Hawkinghttp://en.wikipedia.org/wiki/The_Real_Stephen_Hawkinghttp://en.wikipedia.org/wiki/The_Real_Stephen_Hawkinghttp://en.wikipedia.org/wiki/The_Real_Stephen_Hawkinghttp://en.wikipedia.org/wiki/The_Real_Stephen_Hawkinghttp://en.wikipedia.org/wiki/The_Real_Stephen_Hawkinghttp://en.wikipedia.org/wiki/The_Real_Stephen_Hawkinghttp://en.wikipedia.org/wiki/The_Real_Stephen_Hawkinghttp://en.wikipedia.org/wiki/The_Real_Stephen_Hawkinghttp://en.wikipedia.org/wiki/The_Real_Stephen_Hawkinghttp://en.wikipedia.org/wiki/The_Real_Stephen_Hawkinghttp://en.wikipedia.org/wiki/The_Real_Stephen_Hawkinghttp://en.wikipedia.org/wiki/The_Real_Stephen_Hawkinghttp://en.wikipedia.org/wiki/The_Real_Stephen_Hawkinghttp://en.wikipedia.org/wiki/The_Real_Stephen_Hawkinghttp://en.wikipedia.org/wiki/The_Real_Stephen_Hawking

http://en.wikipedia.org/wiki/The_Real_Stephen_Hawking",1,1,1,1,1,1,True
3a5bc530970e9e4f,"Also, frankly, you're the one being passive aggressive. If you're going to give your opinion about someone, or even insult them, don't beat around the bush. You're the one being exactly what passive aggressive entails:, calling him *indirectly* ignorant of your (the groups) rules, acting in an elitist and authoritarian manner, calling him childish, indirectly threatening him with administrative action and so forth. I repeat, you are a douche.",1,0,0,0,1,0,True
7259f9ea5df5ee60,"see your userpage you stupid bitch
heeeeeeeeeeee",1,0,1,0,1,0,True
b3e458f57077255b,hey bitch you want to get fucked up meet me at 7 11 big bad varrio cochella fuck the rest. you are a fucken nerd ill whop ur ass,1,1,1,0,1,0,True
7b861c8ca4ffe80d,You sound like an idiot.,1,0,1,0,1,0,True
f92752213daf54a0,"You are a racist pig, loser.  Don't vandalize again.  14:54, 28 Jan 2005 (UTC)",1,0,1,0,1,0,True
a4f9c362380c09ab,"Will you help me rephrase my comment as a civil criticism?  Since you're like, a professional Wikipedia contributor or some shit? (bahahaha...bet that pays real well, huh??)  Basically, in my civil criticism, I'd like to communicate that this Tgeairn douche bag is a huge ass hat, he wastes his life on this punchline of a website playing hall monitor.  It's like he wasn't loved as a child, or wasn't cool enough (?) to be a hall monitor as a kid.  I'd also like to express how he enjoys making love to various domesticated and non-domesticated animals on a regular basis, and also spills his seed on other Wikipedia poindexters every once in a while.  As a professional Wikipedia user (bahahahahahahha!) can you help me, a n00b, express this as part of a civil criticism?  I'd really like this Tgeairn ass hat to feel really bad about his life choices as a result, that's my goal.  Thanks Tgeairn!",1,0,0,0,0,0,True
219870ce9c1ba050,Apparently YOU care about it.  Look at all the characters you typed.  What the fuck is wrong with you?,1,0,1,0,0,0,True
c5b18c953e0f4216,"Admin or Fascist? 

Just wondering, are you a Admin, a Fascist or both?

So the only crap one can post on Liberalpedia is crap from God-hating liberal sites? You undid two links of mine because they actually are based on what the Bible says? What a sad LITTLE boy you are.69.14.97.53",1,0,0,0,0,0,True
5f04a07ebb59fa3d,Alansohn tucks his sack back every now and then and tells his gay roommate to call him Sandra.,1,0,0,0,0,0,True
4dfbf1bf515f827e,"Oh wait, disregard that I suck cocks",1,0,0,0,0,0,True
60521326e2bbd0ad,"The Dirtball

What is your f-u-c-k-i-n-g problem, asswipe?  You are actually defending The Dirtball?  Well, it is my humble opinion that you are, in fact, a true dirtball!  Get a life, you lousy piece of toilet trash!",1,0,1,0,1,0,True
cee7805dc6df7b6e,"Hey, CambridgeBayWeather, quit being suck a fucking homo and get a fucking life instead of just sitting around and making sure nobody fucks with wikipedia. Fuck you, and quit editing MY page you fucking homo motherfucker.",1,0,1,0,1,1,True
30d3b70a9b5c8b35,"Its time to pay back 

you are an asshole an asshole and yet again an asshole
total idiot you are a real piece of shit",1,0,1,0,1,0,True
765eaa284fe9790f,"Jack and Jill 

Oh come on, just because you come from that ass-retarded Prince George and that your Dad also happens to be your sister, it's no reason to be such a fucking pain in the ass. Maybe you should move to Prince Rupert if you are that anal!  Ban me ass-hole, I am using a public IP in a Starbuck anyways.",1,0,1,0,1,0,True
07fe8cc9fbd81947,You are a raging faggot.  Kill yourself.,1,0,1,0,1,0,True
45e020eb74428f66,"Gay 

Isn't it notable that there are gay members in the band? I don't know which of them are gay, but there are some gays in there. A magazine here reported that two of the band members got married to each other. I'm sure this is a notable fact. ►   ( Talk ♥ Contribs ) ♪♫",1,0,0,0,0,0,True
f5239c5e3e66334b,"http://www.horacemann.org/home/content.asp?id=1142

STOP LYING ON THE HM PAGE STOP MAKIng UP LIES THE FACTS ARE ABOVE.  YOU ARE CLEARLY OF THE WORKING CLASS",1,0,0,0,0,0,True
dfc81e7bbc8ac044,"Stop your crap, little kid
Aggrotech isn't a fusion genre. Japanoise is not an outgrowth of Industrial music. Do u understand? No? Maybe i should try Spanish language.",1,0,0,0,0,0,True
5da61819a9ff939c,"asshole 

screw you fuck fuck fuck asshole fuck u a duck fucked a kangaroo and that duck is u fuck u for fucking a kangaroo bitch",1,1,1,0,1,0,True
58a343dd7d51b6db,"Nuts 

Wow. You're a nutter. 66.68.86.111",1,0,0,0,1,0,True
0d6ea3ed37bb1bbe,"Black men can't... 

Black men can't read, write, spell, walk, think, dress or speak, but appareantly they can jump...",1,0,0,0,1,1,True
241bf219ae80e6fd,"Guess WHat

Your an ass",1,0,1,0,1,0,True
fbe8e4a0da16b8a8,"STOP 
STOP DELETING MY COMMENTS U COWARD.",1,0,0,0,1,0,True
96b514a4783caa2f,"There are multiple sources to go to pal....... 

You go to one music source on the internet and that's the be all end all. There are many sources to go to in order to find info on Allin and T.T. Quick........You could just buy the albums and look at them. I guess you're one of those people who are just experts on every subject, right!   What else do you do on your computer all day?  I wonder!  You're full of shit.........and you know it!",1,0,1,0,1,0,True
d632ed6279e3dc06,Anna Frodesiak is asshole,1,0,1,0,1,0,True
5e02e06be5c4ed9e,Go fuck yourself you piece of shit.,1,1,1,0,1,0,True
1eeb5f133c1a932b,"""
[[™]]whoever is the next person to write on this page has admitted to having aids and fellates aids monkeys non-stop. you can't edit my page. this is my user page and amounts to hypocrisy. the winner is user:Tbhotch""",0,0,0,0,1,0,True
5919f8cdc3c63f1d,too be honest with you im fucking sick of editing all i do is go around after other cunts that think they know what they are talking about when most of the fucking articles dont make any sense what so ever people fucking quoting student newspapers i mean fuck off.,1,0,1,0,1,0,True
eafbde2827d823d2,"giving out someones personal information, and it shows you how much of an idiot you are.",1,0,1,0,1,0,True
09eb7d87b8c24ca5,"Please stop. If you continue to ignore our policies by introducing inappropriate pages to Wikipedia, you will be blocked.",0,0,0,1,0,0,True
a2f59e64d8d5c396,And I don't understand what you try to tell me. So shut up and don't change my contributions!!!!,1,0,0,0,0,0,True
9264c24c1c327ed7,"""

 Where is Your """"Wiki-Page""""? 

Yo Joe, good buddy!  What happened to your """"wiki-page""""?  How is your ego holding out, you moron.  It serves you right for the way that you treated us on Fidonet.  Revenge is a dish best served cold, my friend.  It might have taken us years to get back at you, Hitler, but it was well worth it.""",1,0,0,0,1,0,True
79311aa196e54991,tiderolls... you are a shitty phage and you desperately need a life.,1,0,1,0,1,0,True
58eeb7fda1e1de40,"""

 Dear Wanker 

It's called a talk page for a reason, and I'm giving you the straight talk.  You probably know relatively little to nothing about Elk Grove, so when I say I have something to say to you, don't be a pain in the ass, and just let me make my case that because your ignorant about my town, you don't have the right to call what I do """"unconstructive vandalism""""""",1,0,1,0,0,0,True
1f1abb0e6ddac0bc,"FAKE BLOCKING 

EARLIER THAT BLOCK WAS FAKE IF YOU KNOW SO MUCH CAN YOU PLEASE STOP TOUCHING MY STUFF OR I AM GOING TO NEVER GET ON WIKIPEDIA EVER AGAIN I AM GOING TO CALL YOU GAY 10 TIMES A DAY NNNNNNNNNNNNNNNNNNNNNNNNNNIIIIIIIIIIIIIIIIIIIIIGGGGGGGGGGGGGGGGGGGGGGGGAAAAAAAAAAAAAAAAAAAAA.",1,0,1,0,1,1,True
0086998b34865f93,"Fuck you, block me, you faggot pussy!",1,0,1,0,1,0,True
718acd377a46e088,"I heard Mark Kermode say today that Turbo was rubbish, and he's never *cough* wrong! He doesn't like F1 but he loved Senna and liked Rush as well.",1,0,0,0,0,0,True
95147bcf9dbef5bc,"""
No your wrong, EVula said it was about personal attacks s/he didn't mention anything about hijacking a page you dumb cunt. Jack In """,0,0,1,0,1,0,True
d659126c8c11a10c,"Fuck you too, you fascist piece of shit.",1,1,1,0,1,0,True
cd97a234afea2cd0,"What was racist about the comments I put! There is no sight of that. And where did I say about aryan brothers? You just tell plain lies. The sources I have given are very reliable scientific facts and for it to be on 3 newspapers tells how true and reliable they are. No one will post them if it is not a fact, so as its a fact and the main genetic article it deserves to be on the article as the people who conducted that study should be respected. You have no respect or common decency. You just want to remove anything that don't sound mediterranean appealing to you. While Im not racist I am anti turkish and yes I admit it. Look how much damage the turks have done to Bulgaria and also other Balkan nations. Millions perished during the occupation and many have fought for those nations to be independent. For you to not support an anti turkish person makes you a traitor. Maybe you are of turkish decsent? Also you want to filter out scientific facts that supports a theory that bulgarians are purely white european and not turkic and instead you support lies that say bulgarians are mediterranean and should be turk friendly. This is anti-white and anti-european.",1,0,0,0,0,0,True
f12ddad3efc50f25,"COMPLAIN & AND MORE COMPLAINS THATS WHAT U'RE GOOD FOR !
FUCKIN IDIOT !
If I happen to know who u are I'll wallop the shit out of u damn bastard !",1,0,1,0,1,0,True
d83cf58891ab4003,"""

No it isn't. Pathetic. I have better things to do than stalk a troll like Tarc. Ask , if you doubt my involvement with Beatles albums articles.♦  """,1,0,0,0,0,0,True
5572cab234c954d1,"outlawed as an apothecary? Any evidence other than one example? The Montepukes ran from the plague, while Nostradamus got the plague and survived and fought it, so being a Doctor was 'qualified,' only rich low level intelligencia were thus called, and why they were cowards. The lemon head uses 'the attack me' of please do hurt me complaint when in fact, he  lives for this page as his resale department. What some 15 or more books, all changing narrations because it had no idea of what it says? Common. At least Wilson showed that Lemonhead is a liar.",0,0,0,0,1,0,True
165fe8bb208c44d0,"Now.. For the picture page to remain, what do you need remove on the pages.

Two, can you remove the fraud external links, you make all Nigerian look like fraud or con artists....
this is my request.",0,0,0,0,1,1,True
5705740a4a28ea3e,"fuck wikipedia, ban me then, i dont care, come wikisuckmedik",1,0,1,0,1,0,True
4ad67ad4f5ab937d,"Ummmmmmm Sex Lady
Ummmmmmm Sex Lady
Ummmmmmm Sex Lady
Ummmmmmm Sex Lady
Ummmmmmm Sex Lady
Ummmmmmm Sex Lady
Ummmmmmm Sex Lady
Ummmmmmm Sex Lady
Ummmmmmm Sex Lady
Ummmmmmm Sex Lady
Ummmmmmm Sex Lady
Ummmmmmm Sex Lady
Ummmmmmm Sex Lady
Ummmmmmm Sex Lady
Ummmmmmm Sex Lady
Ummmmmmm Sex Lady
Ummmmmmm Sex Lady
Ummmmmmm Sex Lady
Ummmmmmm Sex Lady
Ummmmmmm Sex Lady
Ummmmmmm Sex Lady
Ummmmmmm Sex Lady
Ummmmmmm Sex Lady
Ummmmmmm Sex Lady
Ummmmmmm Sex Lady
Ummmmmmm Sex Lady
Ummmmmmm Sex Lady
Ummmmmmm Sex Lady
Ummmmmmm Sex Lady
Ummmmmmm Sex Lady
Ummmmmmm Sex Lady
Ummmmmmm Sex Lady
Ummmmmmm Sex Lady
Ummmmmmm Sex Lady
Ummmmmmm Sex Lady
Ummmmmmm Sex Lady
Ummmmmmm Sex Lady
Ummmmmmm Sex Lady
Ummmmmmm Sex Lady
Ummmmmmm Sex Lady
Ummmmmmm Sex Lady
Ummmmmmm Sex Lady
Ummmmmmm Sex Lady",1,0,0,0,0,0,True
857f0dcb9d9a5ac4,"Three days after I had notified all editors, DreamGuy falsely calls me a lier on his talk page Here. This clearly required a response. It was clearly DreamGuy's intent to harass me and to provoke my reply.",1,0,0,0,0,0,True
55db88cf87e45222,"""

 RealDealBillMcNeill is a fool. 

According to everyone here, we are not fond of the way you handle the 2002–present page. Do you even watch the product? Many times including the WWE 2K14 video game distinguishes the respective eras. Those being Ruthless Aggression, Universe Era and literally last week as Triple H stated, Reality Era. My contributions are accurate and it's insulting how you have """"Brand Extension"""" as if that was the only history for 10 years. I categorized by eras and even added important information you left out, because you think you know better. You are an idiot and need to stop acting like you own this page. Now you've gone and snitched so I can't rightfully edit this page. You are a coward and an idiot.""",1,0,0,0,1,0,True
9d5da0133230757c,"WHY DON'T YOU JUST BLOW IT OUT OF YOU ASS, YOU DIRTBALL?  #### OFF, ASSWIPE.",1,1,0,0,0,0,True
282f3fa2114875a3,THIS IS FAR LEFTWING UAF CRANK who deletes/discriminates against bnp supporters:,1,0,0,0,0,0,True
