id,comment_text,toxic,severe_toxic,obscene,threat,insult,identity_hate,is_bad
d23dc81219f33ea3,"""
 I think you actually skipped the """"friends"""" part and I insist from the pattern of your posts that you are very much a Turk hater!""",1,0,0,0,0,0,True
89b737502b5036c9,"I know you will, all you do is troll users, make threats, and edit pages to try to make yourself seem like less of a loser. It's very, very sad. Most of the time edits are done by RANDOM mods, but I know if I come here I have your attention because that's the only attention you can give. It's why you're just a troll on wikipedia and nobody positive cares about you. Continue to troll and abuse any power you got from Wiki, regardless of how irrelevant, insignificant, and pathetic each attempt is. I think I get editing privelages back in 3 days lol",1,0,0,0,0,0,True
bc0a1ec409413859,"I'm sorry 

I'm sorry you're black I know it's hard to afford the unniggerfication surgery",1,0,0,0,1,1,True
9734959e22546b1c,"Banned 
I'm no longer banned, could you ban me again? You're a moron. Please wear a cape while you are banning me )",1,0,0,0,0,0,True
7a9ed4958bdf833a,", who blantently privledge shit over quality",1,0,0,0,0,0,True
3c0e68a952c1442d,"There are lots of faggs in this world, and that's why this word is not an insult attack, so piss off!",1,0,1,0,1,0,True
0e93590990c01635,"FUCK YOU 

I MOTHERFUCKING HAVE BEEN TRYING TO TALK TO YOU AND ALL YOU DO IS DELETE MY COMMENTS.  FUCK YOU, DON'T TOUCH MY TALK PAGE.",1,1,1,0,1,0,True
724f3e45715074cd,", but be careful because I took a shit in it",1,0,1,0,0,0,True
d005dbb50fdd17c9,I am a gigantic faggot,1,0,1,0,0,0,True
564a647a1506de01,"A proposal to cut down on AIDS 

Less AIDS would be spread if you were to stop inserting your minuscule penis into little boys.",1,0,1,0,1,1,True
8ac0cec5186cd095,Please fuck off.200.122.128.152,1,0,1,0,0,0,True
79d9c8ba4b0697c1,"I'll tell you what you are... 

...you're a horrid, horrid, hooooooooorid, HORRID HOOOOOOOOORRID FING. Basically, YOU ARE NOT LIKED. 81.156.118.227",1,0,0,0,0,0,True
2b73c96e10a6dd5d,IT WASNT ORIGINAL RESEARCH. I'm soooo scared. Last warning. I'll just change my *ucking IP.,1,0,1,0,0,0,True
20c6b3583d3960f8,"Media Prostitute is dead. 

this little man, who indiscriminately wiggled his tale in front of those in power, while denigrating his self-credence by repeatedly defending propaganda views with an... authoritative voice of a mere media whore he was, is finally dead. amen.",1,0,0,0,1,0,True
07fa808e885ab8d0,"How come 

some of the worst human beings on earth happen to be admin on your oh so beloved, oh so protected internet site?37.230.30.171",1,0,0,0,0,0,True
f181c04a8a82aab7,"_
ReignMan is a really ignorant person, and a perfect example of why Wikipedia is not to be trusted.
_",1,0,0,0,0,0,True
f97edebe2f9dc0db,it's just the damn internet.,1,0,0,0,0,0,True
60bb4a0056e7d8d2,"Matt Crypto, Craigy144, and Stormie are jealous losers and liars",1,0,0,0,1,0,True
b4f2324181c17098,stop ur stupid invlovment===,1,0,1,0,0,0,True
ada5a7ca0ec7c8db,"You dummasses, I DID SAY THE DAMN RIGHT STUFF BUT YOU BASTARDS ACT LIKE IM MAKING MY OWN STORIES DUMMASSES",1,0,1,0,1,1,True
4bca1d1ad5c48f7e,gian snowman sucks willies.,1,0,1,0,0,0,True
4e69ed2d52f321d4,"""

 The original """"poster"""" is an idiot.  He listens to music like Linkin Park and Limp Bizkit and calls it """"metal"""".  Since metal is much more diverse than his nu-metal he has trouble forumulating thoughts within his small collection of neurons called his brain.  Plus people of intelliegence are able to distinguish the metal genres quite easily.  The OP needs to commit suicide.""",0,0,0,0,1,0,True
f0aa5d856e7c339e,"You're being a jerk. Block who you want. I'll just change my IP. Who the hell to do you think you are, anyway? I read the warnings and considered them. Keeping them up there is some kind of anal retentive power play on your part. You're exactly why wiki mods are considered ASSHOLES.",1,0,1,0,1,0,True
8ef4341be669c069,"then you leave my shit alone ok. i cnat stop you from messign with my skyview page, but dont you dare tocuh my user page or profile again, do you understand me?",1,0,0,0,0,0,True
fc233d00bee54917,"what they speak behind your back when they're ripping you off; Hebrew is what they speak when they're drinking the blood of Catholic babies.

Yiddish is",1,0,0,0,0,1,True
85aaf8ef3cb2ab1b,Wicked Person.... Wicked Demon that is in you. I rebuke you in the name of YEHOVAH God the Name of YESHUWA HAMASHIACH the Son and the Holy Breath.....,1,0,0,0,0,0,True
76648e5f11d3399a,"Wow asking some one his nationality is racial, don't you think you need to grow up then. In that case every author writing article on your bloody jihad would be a hero, And every american who were killed are fools. For me you all are the same, i wont see a pen in your hand. it will be some freaking gun or grenade.",1,0,0,0,0,0,True
6796e5c4f9a1aac2,"Sleazebag 

Jimbo, you are a sleazebag. Please go away.",1,0,0,0,1,0,True
096aa08835d2c1f1,"ADMINS SCREW OFF 

SCREW OFF YOU FUCKING RETARDED ADMIN!!!",1,1,1,0,1,0,True
87817089bd0a7f2d,"""

City departments

As of 70 minutes ago, Sturgeon bay fire dept responded to the holiday motel right at the east end of the downtown bridge.

Get this, they have 2 pumpers, 1 mini pumper, 1 tanker, 1 ladder truck, and 1 rescue truck from the city.... AS WELL AS 1 pumper, 1 mini pumper, and 1 rescue from the southern door fire dept...... And they have only started (as of this writing) to try and put it out!!!!! Even then, there are only 3 people actively fighting the fire - the rest are just standing around WATCHING!!!

WHAT.... THE..... F***!?!?!?!?!?! When did the fire dept turn wimps??? And WHY are the citizens paying for all these firefighters when they're not doing anything???

Will fast-track the photos, and get them up on the """"sturgeon bay"""" yahoo group by tuesday, should anyone care to see them.

 """,1,0,0,0,0,0,True
b8b55d6e85472001,"fucking faggot 

UR A FUCKING FAGGOT LOSER SON OF A BITCH 'Bold text'Bold text''''''",1,1,1,0,1,0,True
6adf90a875cdfcfd,"HEY STAY THE FUCK OUT OF MY BUISNESS YOU JEWISH REDNECK MEXICAN FUCKER
I KILL YOU FUCKER STAY THE FUCK OUT OF MY BUISNESS",1,0,1,1,1,1,True
53aaa6e86ea1a4be,"FUCK YOU ! 

FUCK YOU ! BITCH, ILL SHOW UR GAME GUIDE.",1,1,1,0,1,0,True
2e7e8edd78c47bdb,"What the FUCK is your problem, bitch!!!!!!!!!!! 

Why the FUCK did you delete the Dreamtime Festival page, shithead. Some folks are actually interested in things like that, bitch. Why don't you do yourself and the world a favor and stick your head up your ass and take a big whiff. Guess what? Your shit stank, like everyone else, you self-righteous fuck-sissy!!!!!!!!!

                                                    Sincerely,
                                                    The guy that's fuckin' yo MAMA, bitch!",1,0,1,0,1,1,True
e3c48779c5772f37,"fdg 

you like it in the ass huh?",1,0,1,0,1,0,True
adf6c47d6cd9865e,"He said he's WORKING ON IT, The Rouge Penguin, have some patience, Don't be an asshole. -",1,0,1,0,1,0,True
69110d51998457db,"Put a cock in it 

You sound like a bitch on heat screaming for attention.",1,0,1,0,1,0,True
453ac3314a8bcab3,"""

Keep on playing cat and mouse for as long as you like. Wikipedia articles on the Ottoman conquest were too based on SECONDARY SOURCES that were based on PRIMARY SOURCES (the Ottoman military records). Your references are also SECONDARY sources but you are cherry-picking their TERTIARY analyses, estimates and cultural sentiment of an occupied people (""""And thus Bosnia fell to the whisper""""  oh, mine).  Which group of secondary sources should we trust? Western historians (unaffected by the Ottoman conquest) will without exception trust the former. Are you done, finally? (As for the insults, you just added word """"idiot"""" to your vocabulary).   """,1,0,0,0,0,0,True
e55894261f5d86ae,"""

 Ah, typical drunken Irish bitch. If you even are a bitch. You might even be a man, or an...intersexual thing. 

The Irish are anti-Semites who side with the Arabian imperialists in order steal the Jewish homeland. You scum recognize the fake """"State of Palestine,"""" an illegal Arabian colonial entity on Jewish land.""",1,0,1,0,1,1,True
00d1d2f4f247d472,MATT HARDY IS SO FUCKY!!!''Italic text[[Media:Example.ogg]]'''''MATT HARDY IS SO FUCKY!!!,1,0,1,0,0,0,True
99d812e2964551b4,"What's up my nigger? 

Promoting yourself on Wikipedia is a bad idea. You should probably go somewhere else. Maybe you could post some hand-drawn posters in your ghetto?",1,0,1,0,1,1,True
79e9d688af75f7eb,JFDWOLFF is going to find his pants on fire next time he steps out his house and his family are going to laugh- ha ha leave catherine alone you gigolo,1,0,0,0,0,0,True
3113055df9e36475,cant help acting like a little punk ass bitch,1,0,1,0,1,0,True
32176a958383e832,"Corspefucking Art

I used their offical website as help to gte al information right. Therefore, some sentences were left, but also other material was put in. Meaning it isn't again copyright law as this is my own work via help from the band and Metal Archives. aka I put them together...meaning they have different copyright laws to their biography (even if they do) than this one here. So, if anyone wants to help, delete some and put it in wikipedia's OWN words, your welcome, but it took me 2 hours to read through information to do this, and if it gets deleted I will be mad.",1,0,0,0,0,0,True
09954f4c91c75fe4,"Grow up you silly person it's not disruptive editing your reverting is disrupting - hey QED actually pay attention to Wikipedia's own page devoted to people with the surname McKay not Mckay because that name does not exist!(https://en.wikipedia.org/wiki/McKay) Your logic Qed - suggests that this (https://en.wikipedia.org/wiki/McKay) is wrong because McKay has uses an uppercase letter 'K'. You imbecile just ask a specialist in the field of surnames, specifically Irish and Scottish surnames and you will have your answer!",1,0,0,0,1,0,True
4c7a4ddb1ebd8cb5,"Nguyen1310, you are a naughty little boy-girl==
You need to be properly spanked to teach you good manners.

==",1,0,0,0,0,0,True
ad53cf356c5ef0f8,"My real advice is don't be a dick. I have nothing further to say to you or your baseless threats and rantings. You are out of line and have been for ages. I am NOT going to go google something to substantiate a claim that you made! I am sick of the way you have been treating me, talking to down to me and insulting me. Pathetic. If you can handle substantiating claims, then don't make them. You have been attacking me through out and turned this talk page into a crusade against me rather than focus on the topic. You clearly have psychological issues. You have proved nada, only substantiated my claims. And I firmly stand by them. I have raised valid concerns. You have nothing but evaded, attacked, been incivil and then go around calling people dicks. Feel free to take it anywhere. You are in the wrong and clearly you don't understand how to talk to people.",1,0,0,0,0,0,True
52a52d41ba4b6252,Why aren't you banned you fucking Mexican gay prick.,1,1,1,0,1,0,True
cb402c3f01ec666d,"""

 dont ever talk to me ever again 

ur a big giant nub
dont you EVER delete my articles again. they are stuffed with factual facts, and are beneficial to the betterment of humanity. who do you think you are? chris mackay? he was a god! a scottish god! i am offened and am launching a jihad against """"brookie"""". lol l2p nub! lol! what kind of a name is brookie anyways!?!?! what are you from brooklynn? do you love books? are you envious of aaron brooks? is brookstone your favourite store? did you star in the recent film about the fag cowboys entitled """"brookback mountain?"""" do you live an alter-ego as a bookie for horse races? you are a disgrace.""",1,0,0,0,0,0,True
377c207d2b58f7b1,dick has gone limp from fucking hookers. =(''',1,1,1,0,1,1,True
de3c112d4f18ca80,"Make A Deal 

Why have an edit war?

My edit in Now 86

is okay of course

You are just big dicks

and now I fell so bad

This is the worst I've had

Yeah...........

Make a Deal (x3)

Yeah, yeah

Make a Deal (x3)

Yeah............

I'm called GMTV around the globe

I've been lost and have goten a great big strobe

It ain't cool

I've been a man

And now I should take over the land

I'm an only child

It so ain't fair

My parents are the only people who care

You don't understand....

Why have an edit war?

My edit in Now 86

is okay of course

You are just big dicks

and now I fell so bad

This is the worst I've had

Yeah...........

Make a Deal (x3)

Yeah, yeah

Make a Deal (x3)

Yeah............

I promise to not vandal anymore

When I think about it just gets sore

Because I don't vandalise anymore

Why have an edit war?

My edit in Now 86

is okay of course

You are just big dicks

and now I fell so bad

This is the worst I've had

Yeah...........

Make a Deal (x3)

Yeah, yeah

Make a Deal (x3)

Yeah............

Make a deal, make a deal, make a deal with me

Make a deal, make a deal, make a deal with me

Why have an edit war?

My edit in Now 86

is okay of course

You are just big dicks

and now I fell so bad

This is the worst I've had

Yeah...........

Make a Deal (x3)

Yeah, yeah

Make a Deal (x3)

Yeah............

Make a Deal (x3)

Yeah, yeah

Make a Deal (x3)

Yeah............

Make a Deal (x3)

Yeah, yeah

Make a Deal (x3)

Yeah............",1,0,0,0,0,0,True
91e78003439706e6,"""
Hopefully you don't have the short penis, because the two nameless editors will use that against you by claiming everything you do is because you feel inadequate.  Hehehe.   Talk• Contributions """,1,0,0,0,1,0,True
86485e141c9599e5,"Shut up, I fucked your mom's pussy good.",1,0,1,0,1,0,True
fa970c682fb19c9f,"Truth 

That's fine, go ahead and block me.  Doesn't change the undeniable fact that Chris is an asshole.",1,0,1,0,1,0,True
f15fccfeb1ef0b22,"Are you a fool? 

I am sorry, but you seem to be a fool. Write articles and stop flooding.",1,0,0,0,1,0,True
27ac838bd3061adc,"}} 

Someone should address this fucking problem you fucks. People are allowed to delete whatever reference they want without being dealt with?",1,0,1,0,0,0,True
3c5635ce4fe659d5,"Mind your own business, you troll.",1,0,0,0,1,0,True
555f21f06239f604,No Irishlass I think that you are the one that needs to stop harassing people. YOU DO NOT OWN WIKIPEDIA. By the way don't you ever work. Or are you just an old middle aged woman who is obsessed with Wikipedia.,1,0,0,0,0,0,True
f11f6f2149299cb7,"Another award for you! 

It's a pair of pliers, so you can remove the pole from your ass. Way to go!",0,0,1,0,0,0,True
550804b444815ec7,"Another Deletion Dog
I suggest we set this person's page as AfD. Frankly I think most people have had enough of these Nazis.",1,0,0,0,0,0,True
8187c7ed2a1595e3,"Oh nobody gives a fk about it! Linkin Park is a screwy band. Green Day doesn't deserve the PA, they have only 8 fks, and 19 total uses of profanity. 21st Century Breakdown had 8 uses of fk, 5 in Horseshoes and Handgrenades. There is a total of 15 profanities",1,0,0,0,0,0,True
e0a48892a24ad789,"now the nazis are trying to stop us from calling people nazis. and what the hell have german users got to do with it, im pretty sure it was called a world war for a reason",1,0,0,0,0,0,True
099b672f19911fb2,"wikipedian policy

I see now how Wikipedia is. If someone breaks the rules its ok as long as they kiss ass. This is bullshit. He started this stupid shit and was persistent until he got me banned. This is so fucking gay all Ive done is try to help Wikipedia but thanks to this stupid shit Im banned. WTF? See I refuse to kiss ass because nobody on here is better than me. As a matter of fact Im better than everyone else on here.",1,0,1,0,1,0,True
f3c18e07ae11e14a,"Why should I pay any attention to anything you say?  Besides Verbal, you are more responsible for creating this situation than anyone else.  Though Verbal was clearly doing as much warring as I was, you sided with him and blocked me from the only article I care to edit.  You are an administrator who enables the bad behavior of other operators  Wikipedia addicts like Verbal who have no contribution to make except to attack articles they don't like and make trouble for other editors.  You are part of the problem.  I've looked at your talk page, and your decisions are entirely capricious  and without a doubt biased in favor of the editors that you favor.  Wikipedia is a totally fucked up place, and it's people like you who are keeping it fucked up.",1,0,0,0,0,0,True
a84a9b338cc34506,"Well, I have to agree that whoever destroyed the 40k wiki pages deserves to diaf... there was so much information about everything and now it is all gone, so many years of work just deleted because of some idiots.",1,0,0,0,0,0,True
f61da9cbef72648f,kiss my ass you limp dick loser,1,0,1,0,1,0,True
ffc87c6eb1ed4616,Um... okay. Those ARE the rules though. And thanks's for not being as idiotic as that guy Jack Merridew is. He edited my own userpage!,1,0,0,0,0,0,True
8be0ede9ed570045,"LEAVE ME ALONE! 

I hate you",1,0,0,0,0,0,True
8f92f734bf5d722c,WRITE YOUR FUYCKING DISCOUSSION HERE YOU FUCK HEAD,1,1,1,0,1,0,True
dc47e10bb19e1527,decline=I don't fucking think so - 81.154.183.54,1,0,1,0,0,0,True
0ecff4c74454ce33,boobs are sweet and sexy i love them they are so squishy,1,0,0,0,0,0,True
b3cd3fd4a28a46ac,"fuck u asshole 

cock dick ass fuck shit bitch fucccccckkkkk yoooouuu u german fag",1,0,1,0,1,1,True
9d3d8c347e86eddd,"""
You're from the Netherlands, right? Maybe an understanding of English would help you out here. """"REPEATEDLY ADDING LINKS"""" means what to you???  Adding more than ONE external link to a website? I sure hope not. I can't imagine how many people you've pissed off because they've added TWO links to the billions of Wikipedia pages.

""""REPEATEDLY ADDING LINKS"""" means a never-ending addition of links. It doesn't mean adding 17 applicable, relevant, valid links in one day and then never contributing again.  A good example of """"REPEATEDLY ADDING LINKS"""" would be user John Doe adding """"winafreeipod.com"""" to every single Wiki page they come across. If you would look at the timestamps @ Special:Contributions/Vacantlips the user spent a total of a half hour CONTRIBUTING reviews to the relevant album pages. Learn the fucking difference between SPAM and CONTRIBUTIONS you pompous, Dutch asshole.  I'm so sick of the people that think they """"run"""" this website. You should stick to your chemistry day job. Hugs and kisses!!   Dirk Beetstra's biggest fan and English tutor
P.S. And please quit acting so chipper with your """"Thanks!"""" and """"Have a nice day!"""" when you have nothing better to do than revert people's valid contributions because you're a hateful, sorry bastard. <3 XOXO""",1,0,0,0,0,0,True
32b04ae11ab8c5dc,"Did you know... 

... that you are an ugly piece of shit?

Serious question.",1,0,1,0,1,0,True
0b82810ef10b616a,"// Hahahihihoho

Bishone: Is that allowed to say that somebody is mentaly insane in Wikipedia? Cause Ante call me that and i HAVE NEVER said something like that before. // Hahahihihoho",1,0,0,0,0,0,True
2ec3d168e418c706,"FUCKAN STOP CHANGON IT OR I AM TWIST OFF YOURE LITTOL PEE-WEES AND YOURE FUCKON MONKEY

FUCKAN IDEOT my name am JOSSEL MUBEDEON AND I DONE FUCKON MAKE THINGS BETTOR

I FIXES THINGS

undarstand",1,1,1,0,1,0,True
73e4a6eb71969452,"Yes, but Brianann MacAmhlaidh IS a fucking idiot.",1,0,1,0,1,0,True
0daef3c97dafa45e,"Pityful
So you call Suraye who question your Assyrianist bias as racists and Arab nationalists? so that shows how out of touch you are Sinhareb. khon your kind are as bad as Arab nationalists yourself.",1,0,0,0,0,0,True
0e88aa059bd1d154,"""

 WOW!!!! You edited the comment making me look like a classic idiot fanatic right? WOOOOOOOOOOOOOOOOOOOOOOOOOOOW YOURE GOOD, AND ALSO HAVE 00000000 morale... Knowing beforehand you have no morales however I barricaded myself by posting elsewhere too, so gj ian thomson!!!!:D. Heres a link to what the comment actually looked like: http://www.reddit.com/r/conspiracy/comments/2nsl5l/911_conspiracy_extending_to_wikipedia/
Thought it might as well stand there too since nothing but cencorship can be expected by some sheep on wikipedia only just recently realizing that his whole life, his wife and kids, is just there to serve a master, and therefore fanatically defending his beliefs to the contrary despite overwhelming evidence. You can go back you your boring life now Ian. I dont expect this """"no evidence from experts"""" thread to stand for long anyway sheep. And this was supposed to be an objective lexcon!!! Learn something new everyday I guess, or as in your case, rather not because it would mean you life ment nothing:D Keep living in denial Ian, and dont forget to cencor!!! I maen where would we be without cencorship, free and informed ppl? Cant have that...""",1,0,0,0,0,0,True
ba8fee3e2e041c25,"I will not stand for your incompetence. Do better. And it's childish that you feel the need to tattle and cry just because you can't make a valid point and support it. And this is yet another reason why wiki is garbage, why trying to edit here is a waste of time, and specifically why the F1 wikiproject is awful.",1,0,0,0,0,0,True
3ac5141b7d58b47f,"you muppet 

man,you don't know anything about test,i got the truth and you are trying to put the stupid lies in,and it's a swinging neckbreaker,not a TKO,GOT IT!!!",1,0,0,0,1,0,True
275783a5cf2fc3a2,"So you admit to forgetting about Melbourne existing in both Florida and Australia, thereby validating my edit as justified, but cos you're so quick to judge you still lay fault with me?  If you want a thing like wiki to become an open encyclopaedia for everyone and not just geeks, then ditch the attitude and processes cos who can be fucked learning them?",1,0,1,0,0,0,True
436b4ee1b77dc258,"fuck u cocksucker, fuck u!! ill do what i want its an online community and whats a community without cryme?",1,0,1,0,1,0,True
377ff5f8b6c03f17,"Malta is an Arab 

Why are people lying? It is not an Italy thank you very cunting much!",1,0,1,0,1,0,True
0f21a44ba42e1fb9,"Please don't be a cunt and make threats please.  I just wanted to discuss the issue.  The criticism portion is a complaint about school rules, that's irrelevant for an encyclopedia entry.  Have criticism is fine, but these criticisms are not valid for an encyclopedic entry, and further are a POV.

Every school has rules, do complaints of the rules belong an encyclopedia?",1,0,1,0,1,0,True
2ec08cbd511b97e1,"Dude, did you know, it literally, slows down CD burning if you don't have the pro version? It actually makes it slower! The bastards! Maybe that should be in the article.",1,0,1,0,1,0,True
96dcd77b6a610f73,"Hello 

What's up dickhead how's it going ?",1,0,1,0,0,0,True
3c62288cc945f048,"Whoops

I had you confused with someone else, but all things considered, you and your friends can still kiss my ass...Harry and margereat swoger....",1,0,1,0,0,0,True
f81ef843dd824543,"FUCK THE CRIMINAL PARTY OF CHINA ALSO KNOWN AS CPC

AND FUCK YOU, STUPID BASTARD....YOU FOREIGNERS SUCK DICK. WHAT HAS CHINA DEVELOPED IN MODERN TIMES? SQUAT. SO SHOVE IT ASSHOLE, YOU KNOW AMERICA COULD KICK YOUR CPC'S ASS ANYDAY, IN ADDITION TO N KOREA, RUSSIA AND VIETNAM. THROW IN IRAN TOO. IF WE WANTED, WE COULD TAKE ALL OF YOU ON, PIECE OF DOG SHIT. OH WAIT, I FORGOT, YOU EAT DOG",1,0,1,0,1,1,True
884ad0c984f7fbde,Jehovah's Witnesses are a bunch of cultish FREAKS and they need to go ahead and drink the 'kool-aid' now and STOP KNOCKING ON MY FARKING DOOR and shove their hateful version of God up their arses!!!65.69.81.2,1,0,0,0,0,0,True
c7229aac73d5f9df,"chynks 

 cockass 
ya umm hello you goth raghead chynk slyin eyed son of a bitch
remember me?
ya chrome dome bastard",1,0,1,0,0,0,True
73e7d30c1b3ba4a3,No seriously. HE IS BANNED!!! Now by saying that you are feeding the troll. Idiot.,1,0,0,0,0,0,True
33aba13eec8a5aaf,"The irony of this staement goes off the scale, HW. General incivility? Check. Too much time on their hand (sic)? Check. Pornography-obsessed? Check. Dear oh dear, you're not learning anything are you?",1,0,0,0,0,0,True
4d953f9de029720f,"Why You...!
Hammer1980,Your a son of a b-!",1,0,0,0,0,0,True
7835bf5348f67ade,"your time....

You suck because you are RIGHT...it is the third.....and I don't remember yours....STILL...LOL...I wanna say its in October....but something tells me it isn't...",0,0,1,0,1,0,True
2818599dd610bcf0,Just shut your ass NeilN dumb asshole.,1,0,1,0,1,0,True
c7c668a33de5101d,2.   A review of his contributions shows that Conolly's edit style is described perfectly in WP:DICK.,1,0,0,0,0,0,True
cf92e01c53cb9208,"Junior Barranquilla?

WTF? where did you come up with that name? should we call REAL MADRID... ROYAL MADRID??????????????  pleasse revert!!! don't come up with that made up bullshit! Atlético Junior!!!76.19.149.244",1,0,1,0,0,0,True
ae3092c051517f92,"Pedro is a fucking dumbass.  Probably just was bullied as a kid & now, as an admin, tries to get back by being an asshole & blocking ppl for no reaseon.  What a deluded fag.",1,1,1,0,1,0,True
e6c1f382c9f8ea71,bitches be like thanks.,1,0,1,0,1,0,True
cad35dd1bac8e573,"Oh yes, john let us all join the hate fest against turks. Remember Turks are evil and Turkiye should be nuked...Yesssssss",1,0,0,0,0,1,True
d3c53368eac8f6e1,"SlimVirgin, show me the racial insult that I have used to shut up.  And MAKE SURE you know what the hell you are talking about next time.",1,0,0,0,0,0,True
