id,comment_text,toxic,severe_toxic,obscene,threat,insult,identity_hate,is_bad
ad5cfcd66f87fb72,"""

What exactly do you mean by that?
""""sorry, but the purpose of the page is to let people discuss the article, and this editing style of yours is driving off everybody who was actually doing that""""
What do you mean by this """"editing style of yours""""?
Are you suggesting that I have edit anything else but my own text?
Or do you mean that I musn't perform any kind of correction on my own texts?
Where are your """"several warnings"""" that you talk about in the other site and who are OBLIGATORY to all admin before bloking a user?
To let people discuss of what article? what are you talking about? this site purpose is not to discuss any article, are you completely unsane?
Did you read this site entirely at any time?
You have absolutely no rights what so ever to shortened the texts of other people. It is absolutely none of your business and it isn't part of your job as an admi.
I found you vendicativ and partial, and you do not have what it take to be an administrator of this site if of any other.
So, get lost!!!
You too vaguely know about the subject, you do not know essential texts made in original languages (big minus) you don't even have followed the development of the discussions on this site, you first came in a week ago, you make falsh accusations to a victim of vandalism, you deny that fact once presented with evidences of it, you reiter your error and banish that person again because of personal dislike and professionnal failure to read and interprete correctly archives contain, you consciously wrongly accuse me of having perpetrated editing functions on other people text when it is a mistake from you, you are arrogant and insulting, and you deny factual proof who incommodate you.
GO TO HELL!
AND THATS EVEN TOO GOOD FOR A CROOK AND CHARLATAN LIKE YOU.
ask georg to join you, I am sure the profiles feet.
I am done at trying to square a circle or pour a quart into a pint pot,by trying to explain basical things to you. You don't have what it take to get it and it ain't going to happen sometime soon.

Rend mig i alfabeten!

Sophie  
There is more style over me than you could ever dream to possess.Get yourself a life!""",1,0,0,0,0,0,True
f6c38c9edd4e6545,"Loganberry 

i will kill u first",1,0,0,1,0,0,True
4ee0c98f8d863acc,"WikiTheClown 
Hi, please refrain from being a rediculous fuck, as you did by reverting my edit to Ibanez.  Doing so shows you to be a rediculous fuck.  So, kindly go be a rediculous fuck elsewhere.  Asshole.",1,0,1,0,1,0,True
7c9cb7e3c90f15e7,You sad cocksucker..stop editing my article otherwise I am going to report you and sue you!!!!!!!!!!,1,0,1,0,0,0,True
a0afceefbf9691dd,""":No, WTF do you think your doing, ? 
On what authority do you to attempt to deny the editors party to the case at hand the right to make an appeal here, as provided for in policy. I take affront at your offensive remarks, even though I have never interacted with you on this website before. Do not impinge my rights because you think you have to be a cheerleader for Arbcom, or whatever your actually motivation is.
I believe that Mr. Wales is the individual here that has the authority to decide whether or not the appeal(s) have merit. Once he makes that call, we move on.
As I and others have stated, however, blogs and other public forums are available for addressing the kangaroo court proceedings just conducted by Wikipedia's very own Arbcom, under the auspices of an undergraduate wanna be attorney. Am I laughing???
You're damn right I'm laughing!
But that is only because I've had a couple of whiskies to help ease my mind regarding the amount of time and effort I've poured into the issue at hand. Otherwise I'd be crying. 連絡 見学/迷惑 

""",1,0,0,0,0,0,True
2cf47da5b056f706,"""

Go on maps.google.com and type in """"pussy"""", it will go to """"Pussy, France"""" 24.129.237.34  """,1,0,1,0,0,0,True
5f38031eb97e7a27,"the earth is 6000 years old, don't be stupid",1,0,0,0,1,0,True
27664c4c2c5683c3,"I'm not foolish you mother is foolish you prick and replay to me on my account not on my IP!-     

Your such a nerd with acne that will probally die alone (thats a shame) thinking your all cool going on wikipedia everyday of your life and not doing anything if your a teenager that just makes it worse . -",1,0,1,0,1,0,True
29d895fdafae659c,"i think you're a mean prick! 

you are the meanest of them all and I shudder to think you may have bred!",1,0,0,0,1,0,True
46b11188d4c70413,SUCK YOU SUCK YOU SUCK,1,0,1,0,1,0,True
98c0ef2e6053414a,"""
Who fucking cares, are you a goddamn tard. Stop wasting bandwidth with your shithole.\ talk /""",1,1,1,0,1,0,True
f4753fa117f25ffe,Then you need to get laid in the ass badly so you're not such a cunt like this tommorrow 142.163.116.73,1,0,1,0,1,0,True
b8ffe81d3d7c1865,You are the biggest and dumbest idiot I have ever met online. Second to Rhobite.,1,0,1,0,1,0,True
fa7fdc45a69f74db,"Actually I sourced the material, and then you banned my account.  You, are a piece of shit government employee, and I will be altering my IP address from here on, every time you ban me for providing the truth.  To you, I say, fuck you.",1,0,1,0,1,0,True
95ef75f427acf65b,"Get a life brotha==
fick me looking at sum of the shit u been doin. are you queer cunt or what?

and i quote

As I'm currently away from my home ADSL network, I'll be limited since I'm now using a bandwith limited mobile limited connection. I hope to be back when the issue is fixed.

if that dont scream a fucking wanker i don't know what does.

==",1,0,1,0,1,0,True
4cca736d10da6f2a,"""It's funny how the first people to throw around """"possible motives"""" are always the ones who get it absolutely wrong. They get it so completely wrong with all their guesses it's almost as if they weren't guesses at all, but intentional deception. It's pretty obvious at this point to anyone who can think that this guy Ivins was a Mossad asset. He was a Jew carrying out a false-flag operation as Jews do, he pretended to be a muslim terrorist, he and his government pals wanted to...remove...a certain muslim researcher, while manufacturing some more fear of muslim """"terrorism"""" to get the American goyim more enthusiastic about letting themselves be slaughtered in Jew wars for Israel. Oh, you thought your """"soldiers"""" use those pathetically insufficient body armors and faulty rifles cuz there's not enough money? And so it goes. I'm not ruling out the possibility that this Ivins guy and his Zionist Bolshevist friends do this sort of stuff just as naturally as lions eat sheep, instinctively, but there may have been another motive for it as well. They don't want their enemies, muslims and other goyim, standing around when they're developing sophisticated biological weapons to take out entire races of humans, perhaps only sparing the God's Chosen, the Master Race by any other name. The Jews were the real """"Nazis"""" all along. Fools.   

""",0,0,0,0,0,1,True
7781d6f676e841b5,Stop your Bullshit Editing. You are the biggest motherfucker here on wikipedia. Go back and watch your Shit pokemon cartoon and suck your Mom and Sister's Vagina YOU DickHead.,1,0,1,0,1,0,True
24cbef763fcdf688,fuck all this shit in to dickmania,1,1,1,0,1,0,True
e62f11531a848798,"Is sex with dogs animal abuse? 

What about people having sex with dogs? I don't think it's sexual abuse - dogs love sexs, they will screw anything, and dogs love sex with people. This is certainly not animal abuse if a dog is willing to have sex with me or my wife.",1,0,0,0,0,0,True
c5d116ece324814e,"""

vandalism?! is this your idea of a JOKE? its becoming pathetic as every page i have been on has the words """"vandalism"""" and """"blocked"""" and it is aimed at me.ME??? what have I done? oh sorry i might have read something on one of the pages, forgive me please! I'm ever so sorry for looking, also i am sorry for having AOL meaning your accusing me when it is clearly someone else as AOL has shared IP addresses.Again, i ask for forgiveness please...in case your all to stu[id to realise, i was being SARCASTIC

""",1,0,0,0,0,0,True
6b7d867e013deb5d,"I'm Kissing up 

I want to kiss you ass",1,0,1,0,0,0,True
21a8d6268f06bd50,"YOu Are A SOn of Bitch Turk

Just to let you know you know nothing about Azaris or other Iranians. Turks are backwards and the whole world knows about your backward culture and people. You try to pretend you are Europeans when the Iranians are really related to the Europeans and do not care, but you Turks would kill yourselves to be Europeans or white.",1,1,1,0,1,1,True
841c80fca99ec0c8,"are you the tosser behind the closerlookonsyria? - you are a fascist Putinist shill  and liar - you fucking idiot - you think  shabiha nothing to do with houla, russia nothing to do with mh 17, assad regime nothing to do with ghouta - you fucking fascist moron",1,0,1,0,1,1,True
0a31507f0d185fe6,and in the program on last night Crime Museum: The Blackout Ripper he is called a serial killer not only by experts but by the police who catched him !!!! so get your facts right you retards,1,0,0,0,0,0,True
669518d5ae56cc47,"Nazi.  You can delete my talk page, but i do it to you and im banned.  Fucking fascist.",1,1,1,0,1,0,True
19e8af58e6f7465e,"Yay!  Now I'll have time to go work on my dream of laughing at retards who post stupid warnings on peoples' talk pages!  Thanks, By Owner!",1,0,1,0,0,0,True
75169e0246a2f95a,I hate you. You are so mean to me. Stop deleting my pages. You trap cat alien.,1,0,0,0,0,0,True
1388ee1ed652eca0,"You know what, this is bullshit.  Tried to do it twice, but now I'm really done with this place.  Most of the users are just sheep and the inmates are running the asylum.  Even worse, you are guilty until proven innocent.  Not a democracy, not cooperation.  Not the place for me.  I have a life, I know I'm a damn good writer and I'll find a place where my abilities and hard work is appreciated.  Screw Wikipedia, goodbye forever.",1,0,1,0,0,0,True
6491df73197a2517,RUCKA RUCKA IS A PIECE OF SHIT,1,0,1,0,0,0,True
453f5df8272f59a7,R U a F a G? Good god ur handle and page all read like a fruit.,1,0,0,0,0,0,True
0cddaa96b8717c76,"Sephiroth In Kingdom Hearts 

I don't have anything against gay dudes but it really ticks me off that in Kingdom Hearts 1, he was played by a gay guy, sorry if I offended anyone. Sephiroth is not supposed to sound like that! I don't have anything against gay dudes. Anyone else have comments?",1,0,0,0,0,0,True
24ec645502a3ce42,"""

I was not removing, but repairing. Depictions of homosexuality are repulsive and homosexuality is unnatural. Be gay all you want but don't shove it in my face, especially when I'm using an """"educational resource"""" like wikipedia.""",1,0,0,0,0,0,True
adac6cee985cb7a7,"Absolute F'ing Lies 
You are a joke, Wikipedia.",1,0,0,0,0,0,True
ba56f26d1fd2d184,"Ah shut the fuck up he started it, he put that on my page first. But did you warn him? No, Because you're a prick. Now you, Klptyzm and Johnnyfog please die.",1,1,1,0,1,0,True
2b37dd4b80a36b9c,"wiki 

ur such a nerd man....why waste ur time editing wikipedia?",1,0,0,0,0,0,True
2a29ce85bcd126c0,GET THE HELL OUT OF MY BISSINESS ASS BANG 166.170.35.202,1,1,0,0,0,0,True
6f9bbb2e00b86e85,"""
I just thought you should know I think you are a fucking idiot and I don't care if someone removes huggle privilages. I'm only here preventing idiots like you from updating Wiki without proof.   Chat  """,1,0,1,0,1,0,True
135f5c646b1c3dc3,"you are a chicken shit cock sucking pussy bastard! 

you are a chicken shit cock sucking pussy bastard!",1,1,1,0,1,0,True
0fe1a484dc70212e,"being initially search for.

and a parting note: GO FUCK YOURSELF",1,0,1,0,1,0,True
f05c0f10fc8254c4,"What a rude and nasty human being you are, making people's lives a misery on Wikipedia. Go and die you piece of shit.",1,1,1,0,1,0,True
3a8be729e0d6e858,If I wanted an account I would have gotten one already! LEAVE ME ALONE!,1,0,0,0,0,0,True
f68bcc59dcaa8fb2,"Your obessed 

With user KNOWIG what the fuck is wrong with you. Seek psyriatric help",1,0,1,0,0,0,True
0987662ef34a7082,"czechofile is worse than a pedophile 

czechofile is worse than a pedophile.",1,0,0,0,0,0,True
130ecb2c4f086cbb,"Why should we users have to create a user name or log in to avoid seeing this rubbish? If I have the same IP as someone else then it is not my problem!!!

Sort it out!",1,0,0,0,0,0,True
300b05cbfbf3a00e,you are an ignorant bastard LMFAO,1,0,1,0,1,0,True
524a2f6c1a783551,"The Videos I added are OWNED BY ME Dan Chlipala!!!! Did you view any or just delete them? If You view you will see that Written Produced and Directed Dan Chlipala. I AM POWER TO THE PEOPLE PRODUCTIONS!!!!! ALL RIGHTS ARE RESEDRVED by me!!!!! and I have chosen to place them on Wikipedia  THe only Copyright Is MY PUBLISHING THEM ON YOUTUBE!!!!!!!! The Moody Blues ALLOWS ALL IN ALL COUNTRIES!!!!!!! Cage I have PERMISION FROM THE BAND!!!!! Country Joe and The Fish . I have PERMISSION FRON THE BAND!!!! Furry Lewis are PUBLIC DOMAIN AUDIO AND WPA PUBLIC DOMAIN PICTURES at the Libary of Congress!!!! Same for MEMPHIS MINNIE!!!!!! ALL THE YouTube video that I placed are Public Domain or RIGHTS RESERVED by ME AKA POWER TO THE PEOPLE PRODUCTION I think you a fucking jerk to delete them before trying to find out the FACTS in this issue. PLEASE REPLACE THE VIDEOS I HAVE LINKED!!!!!!!!!PLEASE email Me @

dan@omm.bz

Thanks for wasting all mmy efforts ...you jerk!! Lok into the facts in the issue before you take an action . Perinoids have enimies to but YOU are ridicilous ..DO YOU EVER  CHECK FACTS OR JUST AVT??????C

Dan Chlipala ...El Predidanta Power To The People Productions",1,0,0,0,0,0,True
441e71283de099f0,Who died and made you boss!? HUh!,1,0,0,0,0,0,True
006e87872c8b370c,"you are a stupid fuck 

and your mother's cunt stinks",1,1,1,0,1,0,True
f2371dace620c9a8,"Speedy deltion  
I know this artice was deleted. But that was not reason. You did tag on my article without reason? Please explain reason in detail. Now You can't explain reason. You are did it like just robot. You can't think about...I think you are idiot. So I don't care you did it...~",1,0,0,0,0,0,True
13e5e151727db704,"""noobs...
I have contested the speedy deletion, but as a man who respects the rules set in place, I have not removed your request for speedy deletion...
 

Re: AND Atleast7isbiggerthanRowan%27s! ! ! ! ! ! ! ! ! ! ! !
I just thought I would bring this to your attention, too...

 

Thank you for respecting the rules. Please understand no one is picking on you for being new. Simply put, neither the label nor the band meet Wikipedia's notability requirements for music at this time. If that changes in the future, you are more than welcome to resubmit them both.  

Thanks for having the decency to explain - being new plays little role in my concern (this is in fact not a new concept to me, it is simply a lack of practical understanding of the scripting used in Wiki stuff) - and in the meantime I appreciate your forwardness. I'm sure it will not be too long until we can do all this again...
 

 User Name 

Not sure exactly why, but your User Name is genius and is cracking me up.   

Thanks very much, I try.  

Marcus Ramone Cooper 

WELL , We did put do not delete the page . we are working on it ! could yooh at least give the page an hour after being created or so ... we just made it , my sistaer and  i.

I got it covered

lol...i got it covered.. i found the template and I am goin to add it now..but thans anyway..oh and i can see u were about to delete the page me and ma sister (the girl in tha comment above dis one aka Nicki Bookie..=])made.. u reallly should be a little more considerate when wikipedians put things like """"we are working on it dont delete"""" no offensee..=]  

None taken. Likewise, there is an under construction template you can use for new articles, rather than """"DO NOT DELETE DIS PAGE CAUSE WE STILL EDITIN IT"""" which really doesn't belong on an article page under any circumstances. Thanks.  

lol thanks..=]  

J. J. M. Roberts
I saw you had notability concerns about J. J. M. Roberts. I expressed the same, but another user  suggested that holders endowed chairs at major universities are almost always notable. If that's correct, I guess the question is, Is Roberts an exception to the rule?  (talk|contribs) 
Thanks for bringing this to my attention. It looks like he wrote some books too. I'm removing the tag, and hopefully someone can expand the article.  

Arson Committee
What more information needs to be added?

References, for one. Two college newspaper citations and two MySpaces doesn't cut it. I tried to look for some myself, but google yielded very few related hits. More than ten minutes of recorded output, for another. A label. Right now, the whole thing smacks of blatant self-promotion, and that isn't what Wikipedia is for.  

is there a way i can get that page(s) back so i can save it and re-enter it when they have more references?

Any admin should be able do that for you, I think. 

.
What right does a burned out stoner have to tell ANYONE they are not credible?

You know, I get that all the time. 

What the fuck, bongwarrior?  Really dude, please don't infringe upon our liberty to cover our hometown.  The meaningless stats do little to reflect the true character of elkhorn, however the """"dating scene"""" section certainly does.  

Happy Bong Hitting...

I wasn't infringing anything, I was reverting obvious vandalism.  """,0,0,1,0,0,0,True
a111c76bd07a4d22,"hey buddy 

You suck asshole",1,0,1,0,1,0,True
d232d775baeac5bb,"""

HAHAHEEAHHGGGHHHH!!!

TROLLING? ITS NOT TROLLING, ITS WARNING PEOPLE THAT BOB SANTANOS IS A FREAKY MAN!  FREEEEEEEEEKAY!!!

BOB SNATANOS WILL BE FREAKY UNTO YOU BER CAUTIOUS PEOPLE HE IS A FREAKY MAN!!!!!!!!!!!!!!!""",1,0,0,0,0,0,True
a6a09d4f0f627dd4,"I allways knew wikipedia was a joke, I never realized it catered to queers. You can all go and fuck yourselves",1,0,1,0,1,0,True
05505320391d7f26,"it wasn't failed, it was a damn ambush. and if you don't take it off, ill get a court order and have NCIS arrest your sorry ass.",1,0,1,0,0,0,True
7a4ea5d9cef34444,"""

 Yamla the idiot 

If (user.IQ<60)
{
   output="""" Yamla detected! bring the axe."""";
}""",1,0,0,0,1,0,True
233687caaf541ef5,"Slow-ass-i-pedia 

I mean really, with a site this slow, you reckon it is smart to be messing on insignificant userpages the way you do? No wonder it slows down like you wouldn't believe.",1,0,1,0,1,0,True
9fdd56f669c92091,"""

 Fuck you 

Re: """"mark williams radio host"""" and """"ground zero mosque""""  you vandalizing asswhipe....... landing gear from one of the aircraft and bits and pieces of several people were found inside this building, which itself is less than 60 feet from another that was destroyed..... so fuck you and everybody who looks like you moslem mental retards here... that is fucking """"Ground Zero"""" so blow me and suck each other dry. Fuck you""",1,0,1,0,1,1,True
a3380d5f77a713f0,FUCK YOU Jdelanoy. You are German COCK SUCKER & FUCKER MOTHER FUCKER. Good to know how you FUCKED face looks.,1,0,1,0,1,1,True
a0752b259e0169eb,"dude i would like a vandalism only account and a friend of mine thimks your gay 
Ncrossman",1,0,0,0,0,0,True
5de2dbd525bb3575,you can go fuck yourself.,1,0,1,0,1,0,True
55864bb0d57a4946,"fuck you cunt  

block me go a head you cunt licker",1,1,1,0,1,0,True
78f93bb073d69af1,put on block for being a Pagan,1,0,0,0,0,0,True
b72b795379a52e4c,fuck off my stuff bitch,1,0,1,0,1,0,True
704cd990f266ef15,"bad motherfuckers 

There are a lot of them out there.
Keep calm and carry on.",1,0,1,0,1,0,True
2a356ab852a1fc55,I do not have multiple accounts and you are obviously another of Howdy's sockpuppets.,1,0,0,0,0,0,True
caf72aaf7378b3d5,I removed his bullshits. 114.179.18.37,1,0,0,0,0,0,True
8f92c7ee3e4b137f,"ENGLISH INJUSTICE 

this is all bullshit how come every country is one that has for hundreds of years been opressed and raped by england they every bloody reason to not like english people. you can't invade a country e.g argetinia on false pretences and expect people to like you, fuck britian.",1,0,1,0,1,0,True
c844c8153f6872c8,"""

 Yeah 

You're right, he's a complete cock. Runs and tells his boyfriend whenever anyone questions the shitty job he does of """"creating"""" pages.""",1,0,1,0,0,0,True
7ac15a58a79539cb,This guy is a sickening pervert.,1,0,1,0,1,0,True
d59c50e49923625e,FUCK YOU YOU MOTHER FUCKING ASS CRACKER DILDO LICKING PIECE OF FUCKING ASS SHIT!!! GO CHOKE ON A MOTHER FUCKING COCK YOU CLIT SUCK! SUCK MY HUGE PULSATING PENIS AND EXTRACT THE HOT WET SEMEN FROM IT!! FUCK YOU DICKFACE! MY COCK IS REALLY FUCKING HARD RIGHT NOW!!,1,0,1,0,1,0,True
9c22d6ac32c484e7,"-This artcicle is a God Damn joke, it shouldnt be protected, that way you can edit it any way you want, its a joke, so lets have some fun with it, your a fucking idiot if you beleive this shit. Anyone see the scientology episode of South Park, God, that was hilarious, and they didnt even need to make more shit up for scientology to be more of a joke. YOU ARE A FUCKING IDIOT IF YOU BELIEVE THIS SHIT!!! go ahead, piss yourself becuase I am right.  -Anonnymous Stranger",1,0,1,0,1,0,True
d80bdffdd77c7c47,"""

So what?

Go ahead and ban me, I have better things to do than associate with a website that accepts and promotes homosexuality. Why not ban the queer who claims on his user page that he is proud of being """"married and Bisexual""""? what does his perverted sexuality have to do with """"editing"""" an encyclopedia? Soon wikipedia will be financially bankrupt, as it is allready moraly bankrupt. Remember, aids kills queers...  """,1,0,0,0,1,1,True
47ea6b5de8f715b8,"December 2013
Hey motherfucker...only I uploaded the image at Dhoom 3 and then u want to take the credit....if i want, i will upload the same image 100 times, who are you to command me cocksucker? And does Wikipedia belong to your father?? Go to bloody hell asshole...",1,0,1,0,1,0,True
9bd903c6b29d923f,"stupid blocks
real cute first you block then you vandalize my comments. do it agan and i will report you, pov pusher.",1,0,1,0,1,0,True
89b5b03dc89c64b1,and that pic of jatts in delhi is a pic of some villagers or very low castes portraying themselves as jatts!,0,0,0,0,1,0,True
1f276d2ba3a92a79,"Are you moron or stupid or both? I created my personal page for this, so move all this bloody useful information there if it is necessary.",1,0,1,0,1,0,True
dbc87d7d4efd526a,"I DON'T KNOW HOW OR WHERE TO ADD THEM FOR USE IN THE ENTRY!!!!! AND YOUR REVERTING INSTEAD OF DOING WHAT IS NEEDED IS STARTING TO PISS ME OFF!!!! 

75.8.35.177",1,0,0,0,0,0,True
c85f94319de61226,"Three Stooges 

Watch the damn short and you may wake up and realize my edit is not vandalism.  Wikipedia needs to stop letting 12-year-olds like you edit and try to pull a big boy power trip threatening other users that know what the hell they are talking about.  If you had an ounce of sense, you would search the episode, but you don't.

https://www.google.com/#hl=en&sclient;=psy-ab&q;=3+stooges+you+all+just+ejaculated+a+mouthful&oq;=3+stooges+you+all+just+ejaculated+a+mouthful&aq;=f&aqi;=&aql;=&gs;_l=hp.3...1904.10172.0.10936.44.26.0.4.4.0.2230.10092.1j8j2j1j0j3j1j1j1j1.19.0...0.0.49d6jlRNc6I&pbx;=1&bav;=on.2,or.r_gc.r_pw.r_qf.,cf.osb&fp;=4272dadaac92d973&biw;=1360&bih;=612",1,0,0,0,0,0,True
9f56ea9c83ccf5fa,YOU WANT WAR? YOU GOT IT,1,0,0,0,0,0,True
73e454b548c02347,"Zomfg.. You ppl make me laugh.. HA HA HA.. jeezus.. GoD You people need to get a social life, I mean COME ON PEOPLE. Ask yourself this, Are You a potiental re-re or just a full blown retard?!?! And Wishes? Whats this crap about WISHES??? Hes not in the Farking ground [NOT DEAD YOU STUPID IDOIT]XD!!!!!",1,0,0,0,0,0,True
ee5fe040df3befac,"Hubris 

Your unconscionable hubris will be your downfall. With the simple sword of truth will I vanquish ye. Indeed, woe unto ye, for I wax terrible, wielding the blade, ready to smite.",1,0,0,0,0,0,True
0538fb8b2eef622e,"Moral Defense, you slimy toad you.",1,0,0,0,1,0,True
3ccdfb2964b159b8,fuckin crikey fuck off ya fuckin bloke. Crikey.,1,1,1,0,1,0,True
3ca816d2da91fd15,"Images I've taken will not be removed from my user page 

This is ridiculous. I am not going to be bowing to the contention that I am not allowed to use images, that I myself acquired no less, on my user page. Fuck policy. Policy is made by social people who have no better thing to do than constantly bicker amongst themselves about. Policy is inherently flawed because it's made by people who dedicate themselves to a bureaucracy. Under copyright law, I am more than well within MY FUCKING RIGHTS to use these fair-use images of MY taking in this way. Wikipedia policy should be consistent with copyright law and no more. My use is allowed within copyright law. If you think otherwise, kindly direct your concerns elsewhere. Thank you.",1,0,1,0,0,0,True
6a6f4682aaf88202,"QUIT Threatening Me... 

Beyotch!!",0,0,1,0,0,0,True
0ee984d26341a9ff,"What personal attacks, whoever changed it back did only half the job, which is why I say it was done lazy. When it comes to stupidity, I am sorry, you are a stupid fool if you think New Mexico Terrirory and Confederate Arizona were the same country.",0,0,0,0,1,0,True
2835a24b300140f0,"i still edit, asshole.24.196.119.217",1,0,1,0,1,0,True
18003369687cfebf,"Fanatics on Wikipedia
Do you dispute the factual accuracy of the the appraisal?  If so, delete my comments and sanction me. I am tired of the bullshit. Admins who favor proceess over morality and facts make me sick.",0,0,1,0,0,0,True
0bffee778d5c1247,"If you admins can block me for sockpuppetry, then what should I do for what you are doing as a team ,, arent you a sockpuppet hen ???",1,0,0,0,1,0,True
