id,comment_text,toxic,severe_toxic,obscene,threat,insult,identity_hate,is_bad
29e0cf2d255a6c20,"""
  The Anti-Vandalism BarnstarFCUK YOU Doc9871 FOOL 122.111.252.2  
""",1,0,1,0,1,0,True
13dd21442899bf47,"oh why dear johnny boy 

Oi, cock face johnCD my pages that have now been deleted, thanks (sarcasm) but my pages weren't finished i was in rush and planned to edit them later contact me. also keep looking over your shoulder for sisher and his army of trojin horses. remember that name CD sishers coming for you",1,0,0,0,0,0,True
4bc74963b15cf3b2,"new name 

Perezhilton has changed his name to dick sucker.",1,0,1,0,1,0,True
2480a67c648f2266,YOU SUCK!! Deadly ASSASSIN IS GAY,1,1,1,0,0,0,True
30a3868ac3d983de,"listen you spineless twirp, i have a navy cross and a bullet stuck in my leg, dont you tell me i am not in the military. and by the way, I could have you prosecuted federally for a bout 2 maybe more charges, not to mention a law suit from 50 angry Navy SEALs in Norfolk looks good in our favor. you are the internet troll.",1,0,0,0,0,0,True
f5810ec68e3f8a46,"Conclusion 

Dude's a total pimp. I mean, did you see him sitting there in that chair? Exudes pimpocity, I tells ya.",1,0,0,0,1,0,True
d5aa8c932f4a3b6d,"Reply 

YOU CAN'T FUCKIN BLOCK ME!

KISS MY ROYAL THAI ASS.

122.106.14.163",1,1,1,0,1,0,True
7ad6eb25ff0788d9,"""

LOL, haha, you loser Wobbs, yeah maybe I am Epf......NOT. Although he shares some views with me on race and other things, hes some dumb Italian-British mut from Canada that actually annoys me. I have used other accounts on here, but with other anon. accounts, not as a registered user (which is allowed by Wikipedia since IP #'s change all the time). Hahaha, Wobbs, you are a fool, especially with how you place so much emphasis on those books recently released by Sykes, etc. which are minority opinions in the world of population geneticists and other researcher. For your information, Racial Reality isn't a """"neo-nazi"""" site you anarchist loser with no hope because your life is meaningless and you don't know ANYTHING on what you read about with these issues. RR is a neutral point of view that seeks to refute neo-nazi, white supremacists, multi-racial, race-denier, assimilationist, biased opinions that influence works including the authors of those books you mentioned. Stick to being a pathetic lab assistant and get a life you tool and stop vandalizing pages and makin edits to suit your twisted opinons you fool. Hahaha, wow, do u accuse 'sock pupety"""" of everyone who gets under you skin you douchebag ???  23:37, 5 January 2007 (UTC

 - Oh and Veritas you dumb fool, I find it insulting you compare my language to Epf's when at least I know what Im talkin about on this stuff while hes just some pussy who confuses people and his arguments cant comapare at all to the brilliant logic of mine. Hahah, you and Wobbs are the worst contributors to this WIkipedia thing, don't ever use this, no one wants you here !! Hahaha !!! """,1,0,1,0,1,1,True
1ca8d6d049522068,"Snitch 

That's what you are, a horrible little snitch! Don't think I haven't got plans for you you little turd! 188.221.144.7",1,0,0,0,0,0,True
5746f196895d2c2c,""" name was Willie, and he said he was standing about three people away from Elvis at the Patton Hotel in the fifties, and he overheard Elvis say, """"All a nigger can do for me is buy my records and shine my shoes.""""""",0,0,0,0,0,1,True
8c415771288e60a2,"You don't want people to know the TRUTH about utorrant, you FAG!",1,0,0,0,0,0,True
64fc056641dba716,"Bigger Bang Tour Memorable Moments 

Why did you remove the memorable moments from the Bigger Bang Tour page you wanker!
Thats vandalism!
Fuck off and die fuckwit!",1,0,1,1,1,0,True
872d2864e8134a7f,"VIRGIN ALERT VIRGIN ALERT 

get ur ass off being a vandal fighter u fucking no life virgin",1,0,1,0,1,0,True
5021710c7e81e9f1,"Srnec, you blunt idiot! I wrote that article, and I'm 8 years old. Next time you look at an article, JUDJE IT WITH CARE!",1,0,1,0,1,0,True
ecd8ab0e78c57e2f,"Whatever 

I can have my opinons. And in my opinon you are CRAZY!!!!!!",1,0,0,0,1,0,True
46c5a7b0c124b2f5,"I dare you to report me bitch 

YOU FAILED AGAIN TO BLOCK ME WIKIPEDIANS!!

HA HA!!

For some nice big juicy sweet cock,
my number is 248-678-9807

Goodbye lovers.68.79.118.61",1,1,1,0,0,0,True
75fb0613c3f55a03,why should people have to read crap posted by idiots like you?,1,0,1,0,1,0,True
4d31ac28c6834954,"I don't have to explain shit, if you think Dedication 3 is an album too, you're a retard. Stop changing the discography, I will ALWAYS change it back.",1,0,1,0,1,0,True
31f32d00064bb908,"Oh poor baby RE: User:Arcayne
Good, I hope they ban your ass, you stupid fu**",1,0,1,0,1,0,True
477cab7136883ad5,only faggots block people.,1,0,1,0,1,1,True
cc33755565512bff,"""

Good lord! How ever do they manage it over at Holland/Nethlands, Gdansk/Danzig, United States/America ... it must be hell! Hell, I tell you! Hell!! (Or maybe they just don't treat their readers as idiots and can write contextively.) Don't you have a WP:... to guide us through this? pléigh """,1,0,0,0,0,0,True
c3eda62aa5a93215,STOP CHANGON IT FUCKEN MORONS HE AM RUNNEN IN 2008 SO STOP WORKON FOR FUCKON JEORGE BUSH AND STOP CHANGON THE PAGE and you stop beon mene to me my name am jassel mubedian and I am from the war in Iraq and YOU STOP CHANGON THE CUNTREY AND THE PAGE so stop also,1,0,1,0,0,0,True
969975a13cf27fe1,"YOU 

SUCK DICK

97.102.60.171",1,0,1,0,1,0,True
0c31b95015167c1d,"I refer to people's constantly taking the words of Jimbo as policy, the idea of removing any userbox with a political point of view is his point of view.  That's at the core of this problem, you did not notice that an admin skipped over the tfd process and speedied something when there is no rule explicitly against having an opinion in a userbox?  Rather, there is Jimbo saying there shouldn't be any.  I completely understand that he started this, but he is not owner of it, a foundation was set up, perhaps you've heard of it - the Wikimedia Foundation.  I didn't say you had that same point of view, I'm saying that I was just telling the people who do to fuck off.  I made no attack on any editor, that you perceive it as such is truly sad, but such is life.  Perhaps with time you will learn the intricacies of the language.  If one does not want personal pages on a site, one should avail oneself to modify the source code in order to remove them from the site rather than complain that they're being used.  People who overstep the proper bound of their position should die, that I have encountered multiple administrators so far doing so does lead to the desire to fuck off, but I'm not done here.",0,0,1,0,0,0,True
e57500dc589bcfa5,"Are you deaf or blind? I repeat. It started in late 2009, and collapsed in mid 2010, as supported by cites and polls.",1,0,0,0,1,0,True
8836f56c1ceef764,"No, you DIDNT. That's obvious. Now if you want me to be civil, then shut the fuck up and realize who's right and who's wrong. -",1,0,0,0,0,0,True
5d7d05da756ed682,HumbleGod likes to fuck his horny cousins!,1,0,1,0,1,0,True
3cd691d16111d2cb,GTFO U LITTLE NOOBLET,1,0,1,0,1,0,True
b52fcfbd15462a78,"""

 Me irritating everyone 

If I went about getting angry and being horrible, everyone would leave me alone. Goodbye.  -7   """,1,0,0,0,0,0,True
8c5e095b0769f756,"""

Can you explain me this?

""""However, many figures outside of the Balkans, including senior members of the United States Republican Party and foreign policy analysts such as Dr Yossef Bodansky, still regard Izetbegović as a dangerous Islamic fundamentalist, and there is much evidence to support their assertion. """"

This is totally POV: """"there is much evidence to support their assertion"""". I found nothing in your source. So stop putting crap in the article!  """,1,0,0,0,0,0,True
e8f1b17e2f206372,"douchebag 

you're an asshole.  charlie.",1,0,1,0,1,0,True
234d9a0c73c42c06,your a faggot and a nigger,1,1,1,0,1,1,True
950289915676e6d7,you stink shoo woo woo,1,0,0,0,1,0,True
f3e9e82375d0be95,"""

 Welcome to your reality check 

By protecting your page you moron communists are also protecting your precious messiah. What a bunch of foolish sheep you all are. You don't even realize that you are all tools of the police state. 

I am going to add as much truth to as many of your articles as I can. You can't protect them all. And you can't block me forever. 

I will strike at any time and on any article. 

The joker has nothing on me. 

This will be fun. Let the games begin. 

Rush is right  —Preceding unsigned comment added by 166.190.226.39   """,1,0,0,0,0,0,True
15d80ed27612c40e,"Don't call me a knob, you wanker.",1,0,1,0,1,0,True
92bf172921ba63bf,"""

I think you are doing a lousy job polluting valid information with complete garbage. So, I will no longer link to the wikipedia Clan Davidson """"article"""" and will link to the correct history: ACCORDING to the Highland manuscript believed to be written by one MacLauchlan, bearing the date 1467, and containing an account of the genealogies of Highland clans down to about the year 1450, which was accepted as authoritative by Skene in his Celtic Scotland, and believed to embody the common tradition of its time, the origin of the Davidsons is attributed to a certain Gilliecattan Mhor, chief of Clan Chattan in the time of David I. This personage, it is stated, had two sons, Muirich Mhor and Dhai Dhu. From the former of these was descended Clan Mhuirich or Macpherson, and from the latter Clan Dhai or Davidson. Sir Aeneas Macpherson, the historian of the clan of that name, states that both the Macphersons and the Davidsons were descended from Muirich, parson of Kingussie in the twelfth century. You suck, and this site sucks and your edits are complete crap but I'm sure you feel justified somehow in your pathetic view. Like I said, this page is utter bunk, filled with nothing but false information and I'm done with it because there are plenty of sites out there that actually have legitimate information. Gee, it certainly is funny how I keep getting very distant genetic matches to members of Clan Chattan that are NOT related to the Norman Comyn scum. Cheers.""",1,0,0,0,0,0,True
491971ad53a25394,""":In spite of the admins advice about replies, I think the only reasonable reply to you is """"Go to hell."""" You're so damned bossy, a bully, a liar and an ignorant agendizer. I can't fathom how they let YOU continue here. Maybe another IP block YOURS will be a great idea.75.21.97.99  

""",1,0,0,0,1,0,True
d385259a4954db13,"""This user is a moron who removes relevant information from talk pages when he puts in """"teh block"""". You are """"teh"""" no life loser, think he's special masturbates over his wikipeen wannabe BOFH and I hope you block all of my ISPs IP numbers because it will save me from contributing when I get the itch to. Enjoy your little wikipeen, wikie boy.

""",1,0,1,0,1,0,True
09588ff9835c4569,"Idiot is  what idiot does
202.92.40.8",1,0,0,0,1,0,True
1ef097f8808fce67,burn in hell motherfucker,1,1,1,1,1,0,True
e368a3264e71d56e,So many children to abuse - so little time,1,0,0,0,0,0,True
06205250808cc1f3,"MOTHERFUCKER, DONT BE CHANGING THE FUCKING GTA TIMELINE!",1,1,1,0,1,0,True
d910176ad932b3cb,"Wikipedia is a shit hole.. 

Fuck you Jimbo for creating this fucking shit wikipedia..",1,0,1,0,1,0,True
ecec40d9e46b478d,"""
Yea. It is weird. ;) Man, that does suck. Hopefully the school will accept you though. Did you actually manage to get rid of any stress? My stress levels are going through the roof. And they're getting worse, 'cause I'm applying to study medicine in colleges in Britain as well as Ireland, so on Wednesday I have to the UKCAT, and now I'm panicing so bad. I tried a practice test, and it was so fucking hard!! Now, I'm scared I'm going to screw up, and I won't pass the test, and I'm just panicing so bad. And Ireland's bringing in one as well, and to make matters worse, it's being held on Valentine's Day!!! I mean, how much does that suck? ♥♥Vampire♥Heart♥ """,1,0,1,0,0,0,True
a24324370601999c,"Herb for life, bitch!",1,0,1,0,1,0,True
bcca77e2acdfda86,"""

Defense
DrKiernan, you are the voice of reason at Anna Anderson now. Hopefully, you will ignore the outright lies and stupidities of finneganw and aggiebean. What they call """"abusive"""" and """"harassing"""" is actually TRUTH. They are caught with their cybertrousers down and they don't like it. It truly is good to see these vile abusers sweating. If you decide to look into THEIR histories, you'll see they have a great deal to sweat about, including sock puppetry and other undisciplined rule-breaking. As for me, well, I'm here to fight NAZIs75.21.101.63  """,1,0,0,0,0,0,True
7ce7ed8f431899eb,"THIS USER IS A PLANT FROM BRUCE PERENS AND GROKLAW 

Revoke his rights and ban him  he's an infiltrator.",1,0,0,0,0,0,True
62dbb88eb0711b7f,"Hey Riana

Does it suck to know that even strangers think you are a dried up old shrew? 66.77.102.10",1,0,1,0,1,0,True
c52a8645e8b28c9a,"Saturn, your an ass, and I don't want your crap written on my page.  You're obviously not that smart.  Candidates must file with the FEC or their names cannot be on a ballot.  Catching on retard?",1,0,1,0,1,0,True
2dc35a0b7dfcd3d9,"Yo there! 

You are a useless and fucking douchebag. Go fuck yourself, you are a disgrace to wikipedia!!!! 
YOU, SIR, ARE A BALLSACK!  You think you are so much smarter than everyone else!  Why do you think you are so smart!  I wish you would leave the Wikipedia!  I can't stand the way you BS the man!",1,0,1,0,1,0,True
763e7b99c50ce420,"Maxim 

Yes, he was born in America. Great, what does that prove? you don't need to surge it over every one of his intros just to make the point that you consider the poor guy an American. He made that gun as an Englishman, not some cheap yank. Stop editing shit you jumped up fat wally. ;)",1,0,0,0,0,0,True
9b973fb650149af2,"Hi Alexf,

I just wanted to know why you deleted the Contest Club page I created because I really like that club? In my opinion I think you are a total jerk who likes spoiling people's hard work and effort.

From,
The Angry User you Idiot!",1,0,0,0,0,0,True
c1d6004a0c881ad3,"Sick POV
What the hell? 
User:Izady is a sick fuck:

It should be noted that the conditions in which individuals died varies from site to site. The people that were buried in these graves are believed to have been members of the Kurdish population which was in support of Iranian occupancy of Iraq at the time of their death (circa 1980's) 'and who deserved to die in the hands of patriotic Sunni Arabs of Iraq'. The legitimacy of claims of atrocity are debateable for this reason, 'since Sunni Arabs are too honorable to do any such things'. The distinction between those who have died in military style combat or executed under the direction of a lawful court of President Saddam Hussein, although buried disrespectfully, and those who have been victims of genocide, ethnic cleansing or otherwise murdered innocently and buried efficiently is a bright line; mass burial should not be assumed to be evidence of criminal activity. 'These Shia and Kurds were traitors to Iraq and were fairly tried and executed by the patriot Arab Sunnis for their crimes', although the burial was not always respectful. Victims of chemical weapons are unknown, 'and they too were traitor Kurds and deserved the punishment by the patriotic Saddam government'.",1,0,1,0,1,0,True
31308b9884b6bb67,"""

 Awesome as fu** !!!  t101 ) """,1,0,0,0,0,0,True
e9edd56486a2b772,"I THOUGHT YOU WERE THE ADMINISTRATOR, CAN YOU FIND ME ONE SO WE CAN WORK THE RIGHT WAY, THIS IS COSTING ME TIME I AM WASTING ON IDIOTS AND VANDALS...
Be glad
Can you give me your email, my time is very limited and I am hurt the way I was treated here and my and my associates' postings removed, i thought you are administrator, i mean so many things here we need to change and I want to proove my point on many of my changes, why they need changes, of course, i am not always right, but I know I am most of the time, as far as my bad spelling (sometimes) I really have to type fast, i am working on many srojects and newspaper articles and dont hve time, you should be glad I am here... I ALSO DONT APPRECIATE UNDER USER, WHERE I WRITE MY BIO, IDIOTS CONNECT ME WITH OTHER USERS AND PUPPETS, I DEMAND THIS IS TAKEN DOWN AND NOT RESTORED, ALSO HOW TO BLOCK OTHERS, WHATS THE CODE, HOW TO UNBLOCK AND HOW TO BRING BACK ORIGINAL ARTICLE FROM CERTAIN DATE...",1,0,0,0,0,0,True
ed07203f003a4a96,some jerkoff blocked me,1,0,1,0,1,0,True
5f8ca96a96c175fb,"""
 Alex my """"God fucking well better exist?"""" More ignorance (I'll give you a clue: Not all people who work for my paper are Christian Scientists). You shouldn't be proud of your ignorance. I read and learn about things I write about as a first order of business. You should not be proud of being """"unsullied"""" by knowledge or complexity before you dip your oar in.  """,1,0,1,0,0,0,True
738f7276e7fb27fe,"A CLEARLY AND REGULARLY STATED GOAL OF THE GATO NEGRO IS THE ANNIHILATION OF ALL WHITE PEOPLE.  ANY CLAIM TO THE CONTRARY IS A PATENT LIE.  IF WIKI CAN'T HANDLE THE TRUTH BECAUSE OF ITS PATHETIC, CONTRIVED WHITE GUILT, THEN IT OUGHT NOT ALLOW ANY CONTENT REGARDING THIS SUBJECT TO BE POSTED.",1,0,0,0,0,0,True
731278282a50e29a,"i am not a vandal... 

...you ignorant narrow-eyed creature.",1,0,0,0,1,0,True
dc7a3ac74c653205,"""

Bullshit """"some medical"""" is classic weasel word crap.  I demand mediation.""",1,0,1,0,0,0,True
9073b708c08d2f4c,I honestly believe you are a sock puppet! (thats how wiki admins judge people you know based on a single impression!),1,0,0,0,1,0,True
7b12ab9b1db0c1c9,HAHAHA! GNAA WILL SCREW YOUR ASSES ALL THE WAY TO HELL. VANDALS RULE,1,0,1,0,0,0,True
d3b24a2d22c0ea3b,Yanksox is a Lying faggot!!!!!!,1,0,1,0,1,0,True
d32a102e368f5f34,This article takes Ninjutsu too seriously. Its fucking fake. Get over it. Some guy claimed to be taught by some nomad like figure is the basis for this entire school of martial arts that isnt even EFFECTIVE is real combat. When was the last time a Ninja won  a NO RULES tournament? With the fluke win exception of UFC 4 i cant remember any. Also you dicks going to ninja schools should learn a real martial art like Brazilian Jujitsu.,1,0,1,0,0,0,True
e6cba0f00fc7475f,"""

New Award

Well Done!!!

  The IAmTheCoinMan You Are Really Annoying And You Are Good At Anti-Vandalism Barnstar I, , award you the The IAmTheCoinMan You Are Really Annoying And You Are Good At Anti-Vandalism Barnstar for your multiple prompt reverts to my joke.  Protecting the wiki isn't important, and an unimportant task under that is protecting other wikipedians!  Your efforts are much much not appreciated.  I hope someone cuts of your hands! """,0,0,0,1,0,0,True
ed29309a609fb4be,"""

 Wow, threats are cool 

I love how you threaten to """"block"""" me because you're in bed with those morons in Sonora who censor any truthful comment about their town and write pathetic newspaper articles about a encyclopedia. Go ahead and block me or report me to whoever. Or do it yourself it your an admin. Anyone who threatens me will get called out on it and since I can't tell you off in person here I am on your talk page basically telling you to go fuck yourself.   """,1,0,1,0,1,0,True
3ee214fa8c6fe90f,"J Freeman 

J Freeman is an oppressor and a violent person.  He may also soon come out of the closet.",1,0,0,0,0,0,True
ef68004aad301d7f,"Which one 

New Orleans, as you know is a crackhead infested s hit hole  full of losers a",1,0,1,0,1,0,True
891d1e991150175f,"If you think reporting me is gonna scare me you have another thing coming lol, wise up and top being so immature reporting me to a robot isn't gonna do much, I haven't been threatening you you idiot don't be so sensitive",1,0,0,0,0,0,True
54f1c17d775fa452,"Haha 

God you're a moron.. protecting the fundies...",1,0,1,0,1,0,True
d7fcc245dc20e2fe,You moron.  And what suburb are you from.  A place where that silver spoon glistens in the sunlight i guess,1,0,0,0,1,0,True
a9bc2dafcbd640b7,tYOU ARE A MOTHJER FUCKER COCKSUCKER! YOU ARE A MOTHJER FUCKER COCKSUCKER! YOU ARE A MOTHJER FUCKER COCKSUCKER! YOU ARE A MOTHJER FUCKER COCKSUCKER! YOU ARE A MOTHJER FUCKER COCKSUCKER! YOU ARE A MOTHJER FUCKER COCKSUCKER! YOU ARE A MOTHJER FUCKER COCKSUCKER! YOU ARE A MOTHJER FUCKER COCKSUCKER! YOU ARE A MOTHJER FUCKER COCKSUCKER! YOU ARE A MOTHJER FUCKER COCKSUCKER! YOU ARE A MOTHJER FUCKER COCKSUCKER! YOU ARE A MOTHJER FUCKER COCKSUCKER! YOU ARE A MOTHJER FUCKER COCKSUCKER! YOU ARE A MOTHJER FUCKER COCKSUCKER! YOU ARE A MOTHJER FUCKER COCKSUCKER! YOU ARE A MOTHJER FUCKER COCKSUCKER! YOU ARE A MOTHJER FUCKER COCKSUCKER! YOU ARE A MOTHJER FUCKER COCKSUCKER! YOU ARE A MOTHJER FUCKER COCKSUCKER! YOU ARE A MOTHJER FUCKER COCKSUCKER! YOU ARE A MOTHJER FUCKER COCKSUCKER! YOU ARE A MOTHJER FUCKER COCKSUCKER! YOU ARE A MOTHJER FUCKER COCKSUCKER! YOU ARE A MOTHJER FUCKER COCKSUCKER! YOU ARE A MOTHJER FUCKER COCKSUCKER! YOU ARE A MOTHJER FUCKER COCKSUCKER! YOU ARE A MOTHJER FUCKER COCKSUCKER! YOU ARE A MOTHJER FUCKER COCKSUCKER! YOU ARE A MOTHJER FUCKER COCKSUCKER! YOU ARE A MOTHJER FUCKER COCKSUCKER! YOU ARE A MOTHJER FUCKER COCKSUCKER! YOU ARE A MOTHJER FUCKER COCKSUCKER! YOU ARE A MOTHJER FUCKER COCKSUCKER! YOU ARE A MOTHJER FUCKER COCKSUCKER! YOU ARE A MOTHJER FUCKER COCKSUCKER! YOU ARE A MOTHJER FUCKER COCKSUCKER! YOU ARE A MOTHJER FUCKER COCKSUCKER! YOU ARE A MOTHJER FUCKER COCKSUCKER! YOU ARE A MOTHJER FUCKER COCKSUCKER! YOU ARE A MOTHJER FUCKER COCKSUCKER! YOU ARE A MOTHJER FUCKER COCKSUCKER! YOU ARE A MOTHJER FUCKER COCKSUCKER! YOU ARE A MOTHJER FUCKER COCKSUCKER! YOU ARE A MOTHJER FUCKER COCKSUCKER! YOU ARE A MOTHJER FUCKER COCKSUCKER! YOU ARE A MOTHJER FUCKER COCKSUCKER! YOU ARE A MOTHJER FUCKER COCKSUCKER! YOU ARE A MOTHJER FUCKER COCKSUCKER! YOU ARE A MOTHJER FUCKER COCKSUCKER! YOU ARE A MOTHJER FUCKER COCKSUCKER! YOU ARE A MOTHJER FUCKER COCKSUCKER! YOU ARE A MOTHJER FUCKER COCKSUCKER! YOU ARE A MOTHJER FUCKER COCKSUCKER! YOU ARE A MOTHJER FUCKER COCKSUCKER! YOU ARE A MOTHJER FUCKER COCKSUCKER! YOU ARE A MOTHJER FUCKER COCKSUCKER! YOU ARE A MOTHJER FUCKER COCKSUCKER! YOU ARE A MOTHJER FUCKER COCKSUCKER! YOU ARE A MOTHJER FUCKER COCKSUCKER! YOU ARE A MOTHJER FUCKER COCKSUCKER! YOU ARE A MOTHJER FUCKER COCKSUCKER! YOU ARE A MOTHJER FUCKER COCKSUCKER! YOU ARE A MOTHJER FUCKER COCKSUCKER! YOU ARE A MOTHJER FUCKER COCKSUCKER! YOU ARE A MOTHJER FUCKER COCKSUCKER! YOU ARE A MOTHJER FUCKER COCKSUCKER! YOU ARE A MOTHJER FUCKER COCKSUCKER! YOU ARE A MOTHJER FUCKER COCKSUCKER! YOU ARE A MOTHJER FUCKER COCKSUCKER! YOU ARE A MOTHJER FUCKER COCKSUCKER! YOU ARE A MOTHJER FUCKER COCKSUCKER! YOU ARE A MOTHJER FUCKER COCKSUCKER! YOU ARE A MOTHJER FUCKER COCKSUCKER! YOU ARE A MOTHJER FUCKER COCKSUCKER! YOU ARE A MOTHJER FUCKER COCKSUCKER! YOU ARE A MOTHJER FUCKER COCKSUCKER! YOU ARE A MOTHJER FUCKER COCKSUCKER! YOU ARE A MOTHJER FUCKER COCKSUCKER! YOU ARE A MOTHJER FUCKER COCKSUCKER! YOU ARE A MOTHJER FUCKER COCKSUCKER! YOU ARE A MOTHJER FUCKER COCKSUCKER! YOU ARE A MOTHJER FUCKER COCKSUCKER! YOU ARE A MOTHJER FUCKER COCKSUCKER! YOU ARE A MOTHJER FUCKER COCKSUCKER! YOU ARE A MOTHJER FUCKER COCKSUCKER! YOU ARE A MOTHJER FUCKER COCKSUCKER! YOU ARE A MOTHJER FUCKER COCKSUCKER! YOU ARE A MOTHJER FUCKER COCKSUCKER! YOU ARE A MOTHJER FUCKER COCKSUCKER! YOU ARE A MOTHJER FUCKER COCKSUCKER! YOU ARE A MOTHJER FUCKER COCKSUCKER! YOU ARE A MOTHJER FUCKER COCKSUCKER! YOU ARE A MOTHJER FUCKER COCKSUCKER! YOU ARE A MOTHJER FUCKER COCKSUCKER! YOU ARE A MOTHJER FUCKER COCKSUCKER!,1,1,1,0,1,0,True
6f0c4b9a1b4b6eae,", also: Favonian is a super-huge faggot.",1,0,1,0,1,1,True
f2a3a1c74b9c7a11,"Also, I have the fucking rights to advertise my youtube.com videos1",1,0,1,0,0,0,True
d06386a20fa6ee5b,Shut the !@#$%^&* up!,1,0,1,0,0,0,True
18f35bf40d79d277,"FUCK YOU!!!! stupid IGNORANT!!!!! 

HIM
is a Love Metal band!!!!!!!",1,0,1,0,0,0,True
cbc10228fc78de95,"""
Attention user """"meters"""" his royal highness jizzul the rager is very angry, he wish for your testicles to be delivered to him on a """"silver platter"""" as you are clearly a chump, a squad of royal raging viruses will soon infect your PC.
Many kind regards
                 The office of his royal highness jizzul the rager.""",1,0,0,0,0,0,True
6137e94b6f22b866,"What´s so Civil about War, anyway? 
 I always suspected you were a conservative shill, a hack excuse of a wikipedian with a sinister republican agenda set in motion. Support the troops all you want, they have done nothing wrong other than being born in the wrong period of their nations´ history. The war will fail, the seeds that were planted will never blossom and your empire will crumble. George Walker Texas Ranger Bush had an opportunity, an opportunity unlike any man in the past century to instil peace in a fucked up world. Instead, he did what would hopefully create hegemony, unipolarity in a world dying for a multi-polar force...and you were right there behind him....pusssss",1,0,0,0,0,0,True
8e85809eb9923b20,Dont be gay - Hitler was a form of hero!!,1,0,1,0,1,0,True
0dca89bcb5662c77,All fucking talk huh?,1,0,1,0,0,0,True
02a4e52899344a88,"MILLINOS OF HUNJAN looking at hunjan template not just me other hunjan will fight back, your concept of art bull of shit!! 86.166.250.11   tharkarn and what waste man!",1,0,0,0,0,0,True
bc7fb93bc05e4fc4,"Hi TK 

You, Terry Koeckritz, are a colossal tit. But of course, that's not really your name is it? Thats why you go round trying to hush it up. YOU AREN'T FOOLING ANYONE!!!!! n00b!!!!!!!!one!11",1,0,0,0,0,0,True
